stories_id,publish_date,title,url,language,ap_syndicated,themes,media_id,media_name,media_url
86356018,2012-07-20 10:55:00,"Real-Life Horror: Many Killed, Dozens Wounded At Colorado Movie Theater",http://www.npr.org/blogs/thetwo-way/2012/07/20/157090121/real-life-horror-many-killed-dozens-wounded-at-colorado-movie-theater?ft=1&f=1001,en,False,"motion pictures,murders and attempted murders",1096,NPR,http://www.npr.org/
283860698,2012-07-20 16:06:00,Why Politicians Won&#39;t Talk About Gun Control After A Mass Shooting,http://www.buzzfeed.com/rosiegray/why-politicians-wont-talk-about-gun-control-after,en,False,"politics and government,law and legislation,united states politics and government,gun control,crime and criminals,firearms,murders and attempted murders",6218,Buzzfeed,http://www.buzzfeed.com
283625165,2012-07-13 08:07:29,Children and adults gunned down in Connecticut school massacre &#8211; This Just In - CNN.com Blogs,http://news.blogs.cnn.com/2012/12/14/shooting-reported-at-connecticut-elementary-school/?hpt=hp_t1,en,False,"education and schools,children and youth,murders and attempted murders",1095,CNN,http://www.cnn.com/
258472049,2012-07-20 23:49:20,Gun Control Legislation: Frank Lautenberg Readies Bill In Wake Of Aurora Shooting,http://www.huffingtonpost.com/2012/07/20/gun-control-legislation-lautenberg_n_1691093.html,en,False,"politics and government,law and legislation,united states politics and government,crime and criminals,murders and attempted murders",27502,HuffPost,http://www.huffingtonpost.com/#
83554014,2012-06-24 00:45:02,Giffords' replacement and shooting survivor Ron Barber holds 'Congress on Your Corner' event,http://www.startribune.com/nation/160132965.html,en,True,politics and government,19,Star Tribune ,http://www.startribune.com/
83554581,2012-06-23 22:00:00,Shooting survivor holds 'Congress on Your Corner',http://www.kansascity.com/2012/06/23/3672778/shooting-survivor-holds-congress.html#storylink=rss,en,True,politics and government,30,Kansas City Star,http://www.kansascity.com/
83556821,2012-06-24 03:34:07,Shooting survivor holds 'Congress on Your Corner',http://www.twincities.com/national/ci_20924990/shooting-survivor-holds-congress-your-corner?source=rss,en,True,politics and government,52,St.Paul Pioneer-Press ,http://www.twincities.com/
83569384,2012-06-23 22:09:00,Shooting survivor holds 'Congress on Your Corner',http://www.miamiherald.com/2012/06/23/2864927/shooting-survivor-holds-congress.html,en,True,politics and government,28,Miami Herald,http://www.miamiherald.com/
84287991,2012-07-20 13:59:00,Police: 12 Dead in Colorado Theater Shooting,http://www.usnews.com/news/us/articles/2012/7/20/police-respond-to-shooting-at-colorado-mall?s_cid=rss:police-respond-to-shooting-at-colorado-mall,en,True,motion pictures,1100,US News & World Report ,http://www.usnews.com/
84287892,2012-07-20 19:08:00,Calif. Neighbor of Colo. Suspect Says He Was Shy,http://www.usnews.com/news/us/articles/2012/7/20/calif-neighbor-of-colo-suspect-says-he-was-shy?s_cid=rss:calif-neighbor-of-colo-suspect-says-he-was-shy,en,True,,1100,US News & World Report ,http://www.usnews.com/
84293167,2012-07-20 15:59:37, ALAN TONELSON—A Uniformly Useless Flap,http://harpers.org/archive/2012/07/hbc-90008720,en,False,"politics and government,labor,editorials,international trade and world market",1113,Harper's Magazine,http://www.harpers.org/
84293170,2012-07-18 18:14:35, VIRGINIA SOLE-SMITH—How Mary Kay Cosmetics Sells Women on “Having It All”,http://harpers.org/archive/2012/07/hbc-90008718,en,False,"politics and government,labor,editorials,international trade and world market",1113,Harper's Magazine,http://www.harpers.org/
84293163,2012-07-20 23:30:20, DAN BAUM—The Price of Gun Control,http://harpers.org/archive/2012/07/hbc-90008724,en,False,"books and literature,biographical information,deaths (obituaries)",1113,Harper's Magazine,http://www.harpers.org/
84365034,2012-07-20 14:51:46,"President Barack Obama in Fort Myers: 'Such violence, such evil is senseless'",http://www.tampabay.com/news/nation/article1241286.ece,en,False,"politics and government,united states politics and government,presidents and presidency (us),presidential elections (us)",22,Tampa Bay Times,http://www.tampabay.com/
84397158,2012-07-20 19:02:00,Reddit live updates follow Colorado shooting overnight,http://ocunwired.ocregister.com/2012/07/20/reddit-live-updates-colorado-shooting-overnight/14975/,en,False,computers and the internet,25,Orange County Register,http://www.ocregister.com/
83566784,2012-06-24 03:33:29,Giffords' replacement and shooting survivor Ron Barber holds 'Congress on Your Corner' event,http://feeds.foxnews.com/~r/foxnews/national/~3/0X0BoXMt2Fo/,en,True,politics and government,1092,Fox News,http://www.foxnews.com/
84117773,2012-06-28 23:44:31,"Early reports on health-care decision from CNN, Fox overturned one mandate: Accuracy",http://feeds.washingtonpost.com/click.phdo?i=0e69faabc72fff3c367bbf37ad6a1cdd,en,False,"politics and government,law and legislation,computers and the internet,finances,united states politics and government,medicine and health,television,news and news media,decisions and verdicts,media,insurance,health insurance and managed care",2,Washington Post,http://washingtonpost.com
633947962,2012-07-20 12:25:00,"James Holmes, 24, identified as suspect in deadly mass shooting at Aurora, Colo., movie theater",http://www.cbsnews.com/news/james-holmes-24-identified-as-suspect-in-deadly-mass-shooting-at-aurora-colo-movie-theater/,en,True,motion pictures,1752,CBS News,http://www.cbsnews.com/
700787080,2012-07-20 10:30:00,What You Need To Know About the Batman Theater Shooting [UPDATES],http://www.motherjones.com/politics/2012/07/batman-theater-shooting-updates-dark-knight-rises/,en,False,"politics and government,united states politics and government",1112,Mother Jones,http://www.motherjones.com/
305242377,2012-07-20 12:00:00,Gunman turns 'Batman' screening into real-life 'horror film' - CNN.com,http://www.cnn.com/2012/07/20/us/colorado-theater-shooting/,en,False,"motion pictures,murders and attempted murders",1095,CNN,http://www.cnn.com/
275186496,2012-07-20 12:00:00,'Dark Knight' shooting suspect's neighbor: 'He seemed like a normal kid',http://latimesblogs.latimes.com/lanow/2012/07/colorado-shooting-suspect-neighbor-he-seemed-like-a-normal-kid.html,en,False,"education and schools,murders and attempted murders",6,LA Times,http://www.latimes.com/
805658653,2012-07-12 07:40:23,The Return of the Nullifiers,https://www.huffingtonpost.com/entry/the-return-of-the-nullifi_b_1667483.html,en,False,"education and schools,politics and government,law and legislation,united states politics and government,decisions and verdicts",623375,Huffington Post - United States,http://www.huffingtonpost.com/?country=US
169986497,2012-07-20 23:55:00,"Midnight movie massacre: Colorado Batman shooting leaves 12 dead, 59 wounded",http://www.nj.com/news/index.ssf/2012/07/midnight_movie_massacre_colora.html,en,True,motion pictures,20120,nj.com,http://www.nj.com
819464120,2012-07-20 00:00:00,"12 Dead, 70 Wounded At Denver Screening Of 'Dark Knight Rises'",http://www.businessinsider.com/at-least-10-killed-and-30-40-injured-at-dark-night-rises-premiere-in-colorado-2012-7,en,False,,18710,Business Insider,http://www.businessinsider.com
987471954,2012-07-20 00:00:00,Why the Aurora shooting won't likely change the gun control debate,https://www.washingtonpost.com/blogs/the-fix/post/why-the-aurora-shooting-wont-likely-change-the-gun-control-debate/2012/07/20/gJQA6qWpxW_blog.html,en,False,,2,Washington Post,http://washingtonpost.com
806496105,2012-07-20 14:30:05,What You Need To Know About the Batman Theater Shooting [UPDATES],https://www.motherjones.com/politics/2012/07/batman-theater-shooting-updates-dark-knight-rises/,en,False,"gun control,firearms",1112,Mother Jones,http://www.motherjones.com/
818529748,2012-07-20 00:00:00,"NRA tweeter was 'unaware' of Colorado shooting, spokesman says - CNN",https://edition.cnn.com/2012/07/20/tech/social-media/nra-tweet-shooting/index.html,en,False,"motion pictures,murders and attempted murders",1095,CNN,http://www.cnn.com/
493320608,2012-07-20 22:32:00,A Guide to Mass Shootings in America,http://www.motherjones.com/politics/2012/07/mass-shootings-map?page=2,en,False,"medicine and health,gun control,firearms",1112,Mother Jones,http://www.motherjones.com/
600490728,2012-07-20 14:52:10,Obama Colorado Shooting Proclamation: Flags To Be Flown At Half Staff For Victims | The Huffington Post,http://www.huffingtonpost.com/2012/07/20/obama-colorado-shooting-flags-half-staff_n_1690405.html,en,False,"politics and government,united states politics and government,murders and attempted murders",27502,HuffPost,http://www.huffingtonpost.com/#
813272754,2012-07-20 00:00:00,"Aurora witnesses describe shooter's entrance, chaos",https://www.cbsnews.com/news/aurora-witnesses-describe-shooters-entrance-chaos/,en,False,"motion pictures,murders and attempted murders,violence",1752,CBS News,http://www.cbsnews.com/
633887571,2012-07-20 08:00:00,"Police say Colorado shooting suspect James Holmes had 2 pistols, assault rifle, shotgun",https://www.washingtonpost.com/colorado-shooter-identified-as-james-holmes-24/2012/07/20/gJQAWkdrxW_story.html,en,False,motion pictures,2,Washington Post,http://washingtonpost.com
86352388,2012-07-20 15:56:31,"Ticketholders remain unfazed as cities, theater chains mull additional security for 'Dark Knight Rises'",http://feeds.foxnews.com/~r/foxnews/entertainment/~3/3_XagfN4CE8/,en,False,motion pictures,1092,Fox News,http://www.foxnews.com/
633901947,2012-07-20 22:00:00,"Cops: 12 dead, 11 critical, 58 wounded in CO shooting",http://www.newsday.com/news/nation/james-holmes-claimed-to-be-the-joker-nypd-commish-says-1.3849577,en,True,motion pictures,13,Newsday,http://www.newsday.com/
958487210,2012-07-20 17:41:00,Box Office: 'Dark Knight Rises' Scores Second Highest Grossing Midnight Opening in History,https://www.thewrap.com/movies/article/box-office-dark-knight-rises-scores-second-highest-grossing-midnight-opening-history-48591/,en,False,,18704,The Wrap,http://www.thewrap.com
86371406,2012-07-20 21:50:00,"'Dark Knight' Events Canceled, Theaters Add Guards",http://feedproxy.google.com/~r/NprProgramsATC/~3/leL4MgcY3bA/dark-knight-events-canceled-theaters-add-guards,en,False,motion pictures,1096,NPR,http://www.npr.org/
86341623,2012-07-20 12:49:46,Gunman kills 12 in Colorado movie theater,http://rss.cnn.com/~r/rss/cnn_latest/~3/XKpbkZ3eZUA/index.html,en,False,"motion pictures,murders and attempted murders",1095,CNN,http://www.cnn.com/
86346413,2012-07-20 14:55:39,Colorado movie theater shooting: at least 12 dead – live updates,http://www.guardian.co.uk/world/blog/2012/jul/20/denver-batman-premiere-shooting-live,en,False,motion pictures,1751,Guardian US,https://www.theguardian.com/us
1054946283,2012-07-15 00:00:00,"After alleged 'Dark Knight' threats in theater, man due in court",https://latimesblogs.latimes.com/lanow/2012/07/norwalk-dark-knight-threats.html,en,False,murders and attempted murders,6,LA Times,http://www.latimes.com/
1055006746,2012-07-20 12:40:43,Aurora Suspect Mother: 'You Have the Right Person',https://abcnews.go.com/Blotter/aurora-dark-knight-shooting-suspect-identified-james-holmes/story?id=16818889#.UAlfIjGe5NF,en,False,"television,murders and attempted murders",39000,ABC News,http://abcnews.go.com/
1096395651,2012-07-20 10:18:18,Colorado Shooting: What We Know About James Holmes (UPDATED) | HuffPost,https://www.huffingtonpost.com/2012/07/20/colorado-shooting-james-holmes_n_1688996.html?ncid=webmail1,en,False,"education and schools,murders and attempted murders",27502,HuffPost,http://www.huffingtonpost.com/#
1217546358,2012-07-15 00:00:00,Gov. John Hickenlooper: James Holmes Would Have Created 'Horror' Without Guns,https://abcnews.go.com/blogs/politics/2012/07/gov-john-hickenlooper-james-holmes-would-have-created-horror-without-guns/,en,False,,39000,ABC News,http://abcnews.go.com/
1222840646,2012-07-12 07:40:23,The Return of the Nullifiers,https://www.huffpost.com/entry/the-return-of-the-nullifi_us_1667483,en,False,"education and schools,politics and government,law and legislation,united states politics and government,decisions and verdicts",96720,HuffPost Latino Voices,http://voces.huffingtonpost.com/#spider
1227078044,2012-07-20 20:12:00,Colorado tragedy prompts calls for urgent action on gun control,https://www.theguardian.com/world/2012/jul/20/colorado-tragedy-action-gun-control,en,False,"politics and government,law and legislation,united states politics and government,elections",1751,Guardian US,https://www.theguardian.com/us
1227123211,2012-07-20 00:00:00,Disturbing Amateur Video At Theater Where Colorado Shooting Occurred,https://www.businessinsider.com/video-mass-shooting-at-dark-knight-rises-premier-in-aurora-2012-7,en,False,"motion pictures,recordings (video),theater",18710,Business Insider,http://www.businessinsider.com
1227200314,2012-07-20 10:55:00,"Real-Life Horror: Many Killed, Dozens Wounded At Colorado Movie Theater",https://www.npr.org/sections/thetwo-way/2012/07/20/157090121/real-life-horror-many-killed-dozens-wounded-at-colorado-movie-theater,en,False,motion pictures,1096,NPR,http://www.npr.org/
1227265638,2012-07-20 14:30:50,"Gun Control Polls Show Longterm Decline In Support, Despite Columbine Bump | HuffPost",https://www.huffingtonpost.com/2012/07/20/gun-control-polls-aurora-shooting_n_1690169.html,en,False,"politics and government,law and legislation,gun control,firearms,murders and attempted murders",27502,HuffPost,http://www.huffingtonpost.com/#
1262295712,2012-07-20 11:31:00,Batman Shooter: Tragedy Shouldn&#8217;t Make Policy,https://reason.com/2012/07/20/batman-shooter-tragedy-shouldnt-make-pol/,en,False,"firearms,murders and attempted murders",72523,Reason.com,http://reason.com/
1462537572,2012-07-20 13:41:25,"Aurora Theater Colorado Shooting: How You Can Help Victims, Families (UPDATED)",https://www.huffpost.com/entry/aurora-theater-colorado-shooting_n_1690093,en,False,"medicine and health,philanthropy",96720,HuffPost Latino Voices,http://voces.huffingtonpost.com/#spider
1482835007,2012-07-20 00:00:00,ABC News Coverage Plans - Tragedy in Colorado,https://abcnews.go.com/blogs/headlines/2012/07/abc-news-coverage-plans-tragedy-in-colorado-the-batman-massacre,en,False,"television,news and news media,media",39000,ABC News,http://abcnews.go.com/
1537191595,2012-07-20 18:16:00,"Colorado Police Say 12 Dead, 59 Wounded; Believe 'Dark Knight' Suspect Acted Alone",https://www.thewrap.com/media/article/colorado-police-say-12-dead-59-injured-believe-suspect-acted-alone-48606/,en,False,firearms,18704,The Wrap,http://www.thewrap.com
1792049261,2012-07-20 09:14:52,Gunman turns 'Batman' screening into real-life 'horror film',https://edition.cnn.com/2012/07/20/us/colorado-theater-shooting/index.html,en,False,motion pictures,1095,CNN,http://www.cnn.com/
