stories_id,publish_date,title,url,language,ap_syndicated,themes,media_id,media_name,media_url
81318569,2012-05-16 14:53:00,Website set up by killer's mom upsets co-workers,http://www.kansascity.com/2012/05/16/3613338/website-set-up-by-killers-mom.html#storylink=rss,en,False,,30,Kansas City Star,http://www.kansascity.com/
79612697,2012-04-20 16:40:00,Suspected Texas cockfight organizers due in court,http://www.miamiherald.com/2012/04/20/2759259/suspected-texas-cockfight-organizers.html,en,False,,28,Miami Herald,http://www.miamiherald.com/
338584478,2012-04-21 08:00:00,Anyone else could have saved her: Life is Strange gave my personal tragedy a score,http://www.polygon.com/2015/4/21/8457673/life-is-strange-suicide,en,False,,69395,polygon.com,http://www.polygon.com/#spider
80573000,2012-05-08 07:14:30,"911 call in Arizona suburb: 'He's got a gun. No!""",http://www.twincities.com/national/ci_20569182/police-release-911-calls-fatal-arizona-shooting?source=rss,en,True,"politics and government,murders and attempted murders,violence",52,St.Paul Pioneer-Press ,http://www.twincities.com/
81199612,2012-05-15 04:13:25, SARA BRESELOR—Weekly Review,http://harpers.org/archive/2012/05/hbc-90008618,en,False,"politics and government,united states politics and government,elections,presidents and presidency (us),presidential elections (us),homosexuality,election issues,marriages",1113,Harper's Magazine,http://www.harpers.org/
81292664,2012-05-16 16:23:15,Survivors of warehouse shooting are upset by website of killer's mother,http://www.mercurynews.com/nation-world/ci_20636485/survivors-warehouse-shooting-are-upset-by-website-killers?source=rss,en,True,"medicine and health,labor,blacks,crime and criminals,murders and attempted murders,serial murders",35,San Jose Mercury News,http://www.mercurynews.com/
79271730,2012-04-25 01:31:51,Oakland college shooting suspect not eating in jail,http://rss.cnn.com/~r/rss/cnn_crime/~3/cgRpqPDKcd8/index.html,en,False,"labor,strikes,murders and attempted murders",1095,CNN,http://www.cnn.com/
79780870,2012-04-27 15:42:37,"Penn State spends millions on public relations, hires new firms",http://feeds.washingtonpost.com/click.phdo?i=97948894bc2c7fe26bd522f2f2604650,en,True,"education and schools,crime and criminals,sex crimes",2,Washington Post,http://washingtonpost.com
80703252,2012-05-09 02:34:00,"Slain L.A. athlete mistaken for a gang member, prosecutor says",http://feeds.latimes.com/~r/latimes/news/local/~3/C5httEyP17M/story01.htm,en,True,"blacks,murders and attempted murders",6,LA Times,http://www.latimes.com/
81297299,2012-05-16 16:32:10,Website set up by killer's mom upsets co-workers at Conn. beer distributor,http://www.nypost.com/p/news/national/website_set_conn_beer_killer_mom_gdpe242frpwvy8t7I57U1K?utm_medium=rss&utm_content=National,en,False,"labor,blacks,crime and criminals,discrimination,murders and attempted murders,serial murders",7,New York Post,http://www.nypost.com/
500629126,2012-05-04 08:00:55,15 Stats That Destroy Liberal Narratives,http://townhall.com/columnists/johnhawkins/2016/01/02/15-stats-that-destroy-liberal-narratives-n2098999?utm_source=akdart,en,False,"politics and government,blacks,terrorism,discrimination",19763,townhall.com,http://townhall.com
500771708,2012-05-04 12:00:55,Why'd it take 4 massacres for Obama to vow 'These tragedies must end'?,http://www.investors.com/obama-newtown-shooting-memorial-text/,en,False,"education and schools,politics and government,united states politics and government,medicine and health",27011,Investors,http://www.investors.com
500906840,2012-05-04 12:00:55,More Gun Control? Don't Hold Your Breath,http://www.cbsnews.com/news/more-gun-control-dont-hold-your-breath/,en,False,"education and schools,politics and government,law and legislation,gun control,firearms,murders and attempted murders",1752,CBS News,http://www.cbsnews.com/
543533934,2012-04-23 17:44:53, Norway Killer Says He Hoped To Massacre More,http://www.huffingtonpost.com/2012/04/23/anders-behring-breivik-trial_n_1447637.html,en,False,"terrorism,demonstrations and riots",27502,HuffPost,http://www.huffingtonpost.com/#
604856813,2012-05-04 08:00:55,Bret Baier: Media Silent on Hate Crime Against Decorated Marine,http://www.newsbusters.org/blogs/nb/nicholas-fondacaro/2016/02/19/bret-baier-media-silent-hate-crime-against-decorated-marine?utm_source=akdart,en,False,"politics and government,blacks,television,news and news media,crime and criminals,discrimination",1125,NewsBusters,http://newsbusters.org
812075355,2012-05-16 00:00:00,You'll Never See The Shocking Twist In This Gun Violence PSA Coming | HuffPost,https://www.huffingtonpost.com/entry/youll-never-see-the-twist-in-this-gun-violence-psa-coming_us_5841d5f6e4b017f37fe4891b?utm_medium=email&utm_campaign=The%20Morning%20Email%20120516&utm_content=The%20Morning%20Email%20120516+CID_6399336c46a9a171529e25c61403fbdf&utm_source=Email%20marketing%20software&utm_term=HuffPost&ncid=newsltushpmgnews,en,False,"education and schools,children and youth,murders and attempted murders,violence",27502,HuffPost,http://www.huffingtonpost.com/#
500809926,2012-05-04 08:00:55,White House: Obama Thinks Gun Control Will Deter Terrorists,http://www.weeklystandard.com/white-house-obama-thinks-gun-control-will-deter-terrorists/article/2000061?utm_source=akdart,en,False,"politics and government,law and legislation,united states politics and government,armament, defense and military forces,gun control,terrorism,united states armament and defense,firearms",18658,Weekly Standard,http://www.weeklystandard.com
500823580,2012-05-04 08:00:55,"South Carolina Suspect Caught, and the Politicization Begins",http://www.nationalreview.com/corner/419990/south-carolina-suspect-caught-and-politicization-begins-david-french,en,False,"politics and government,armament, defense and military forces,terrorism,crime and criminals,airlines and airplanes,world trade center (nyc)",1117,National Review,http://www.nationalreview.com/
500681145,2012-05-04 08:00:55,New evidence confirms what gun rights advocates have said for a long time about crime,https://www.washingtonpost.com/news/wonk/wp/2016/07/27/new-evidence-confirms-what-gun-rights-advocates-have-been-saying-for-a-long-time-about-crime/?utm_source=akdart,en,False,"medicine and health,gun control,crime and criminals,firearms",2,Washington Post,http://washingtonpost.com
500603432,2012-05-04 08:00:55,"Gov. Jerry Brown signs 6 gun-control bills, vetoes 5",http://www.sfgate.com/politics/article/Gov-Jerry-Brown-signs-six-gun-control-bills-8336745.php#item-44548?utm_source=akdart,en,False,"law and legislation,finances,gun control,firearms",14,SF Chronicle,http://www.sfgate.com/
443322011,2012-05-04 08:00:55,Has the U.S. had 4 mass shootings this year or 353? Estimates vary that much,http://www.latimes.com/nation/la-na-san-bernardino-mass-shooting-statistics-20151204-story.html,en,False,"armament, defense and military forces,murders and attempted murders",6,LA Times,http://www.latimes.com/
443382992,2012-05-04 08:00:55,"Yes, mass shootings tend to produce copycats. So do terror attacks.",https://www.washingtonpost.com/news/monkey-cage/wp/2015/12/04/yes-mass-shootings-tend-to-produce-copycats-so-do-terror-attacks/?postshare=6921449284320658&tid=ss_tw-bottom,en,False,"medicine and health,terrorism,crime and criminals",2,Washington Post,http://washingtonpost.com
679421111,2012-05-04 12:00:55,Pulitzer Prizes for the Los Angeles Times,http://www.latimes.com/about/la-times-pulitzer-prizes-htmlstory.html,en,False,,6,LA Times,http://www.latimes.com/
1582705748,2012-05-02 00:00:00,Gilbert mass shooting: Former Arizona Sen. Russell Pearce's statement,http://archive.azcentral.com/news/articles/2012/05/02/20120502gilbert-mass-shooting-arizona-russell-pearce-statement.html,en,True,"politics and government,united states politics and government,news and news media,media,crime and criminals,united states armament and defense",25128,AZCentral,http://www.azcentral.com
81884863,2012-05-23 23:22:38,"In Egypt's tourist-dependent Luxor, voters fear an Islamist president would make life harder",http://www.sacbee.com/2012/05/23/4512357/in-egypts-tourist-dependent-luxor.html#mi_rss=Wire%20World%20News,,False,,26,Sac Bee,http://www.sacbee.com/
81884864,2012-05-23 23:17:46,"In Luxor, Egypt&#x92;s tourism center, voters shun Muslim Brotherhood candidate",http://www.sacbee.com/2012/05/22/4512347/in-luxor-egypts-tourism-center.html#mi_rss=Wire%20World%20News,,False,,26,Sac Bee,http://www.sacbee.com/
81891153,2012-05-23 23:21:00,"In Egypt's tourist-dependent Luxor, voters fear an Islamist president would make life harder",http://www.miamiherald.com/2012/05/23/2814535/in-egypts-tourist-dependent-luxor.html,en,False,,28,Miami Herald,http://www.miamiherald.com/
82731716,2012-06-15 05:10:03,National Briefing | Southwest: Arizona: Republican Drops Out of Rematch ,http://feeds.nytimes.com/click.phdo?i=e79321552d6e7462b045484e731c7c40,en,True,"politics and government,elections",1,New York Times,http://nytimes.com
81827835,2012-05-23 13:27:09,Lawyers: Keep Loughner in Mo. facility,http://pheed.upi.com/click.phdo?i=a0121e030c88a1c4e5a32dfa1a8db60c,en,False,"medicine and health,crime and criminals,murders and attempted murders,mental health and disorders",1706,UPI,http://www.upi.com/
81891154,2012-05-23 23:11:00,"In Luxor, Egypt&#x92;s tourism center, voters shun Muslim Brotherhood candidate",http://www.miamiherald.com/2012/05/23/2814509/in-luxor-egypts-tourism-center.html,en,False,"politics and government,united states politics and government,religion and churches,elections,travel and vacations",28,Miami Herald,http://www.miamiherald.com/
82534148,2012-06-07 18:30:00,Republicans clash with AG on Fast and Furious,http://www.kansascity.com/2012/06/07/3647152/republicans-clash-with-ag-on-fast.html#storylink=rss,en,True,"politics and government,united states politics and government,firearms",30,Kansas City Star,http://www.kansascity.com/
82576295,2012-06-13 11:51:11,Why race to replace Gabrielle Giffords matters nationally,http://rss.csmonitor.com/~r/feeds/usa/~3/qfdqiupC4n4/Why-race-to-replace-Gabrielle-Giffords-matters-nationally,en,False,"politics and government,united states politics and government,elections",3,Christian Science Monitor,http://csmonitor.com
82607106,2012-06-13 20:20:04,Republican 'reflecting' about future after losing Giffords' seat in special election,http://www.startribune.com/politics/national/158939835.html,en,True,"politics and government,united states politics and government,elections,primaries,legislatures and parliaments",19,Star Tribune ,http://www.startribune.com/
82617209,2012-06-13 20:02:00,Republican 'reflecting' after losing Giffords seat,http://www.miamiherald.com/2012/06/13/2847840/republican-reflecting-after-losing.html,en,True,"politics and government,united states politics and government,elections,primaries,legislatures and parliaments",28,Miami Herald,http://www.miamiherald.com/
82620345,2012-06-13 23:37:54,Ron Barber's win in Arizona House race a lift for dispirited Democrats,http://rss.csmonitor.com/~r/feeds/usa/~3/Sj0HaATbhVg/Ron-Barber-s-win-in-Arizona-House-race-a-lift-for-dispirited-Democrats,en,False,"politics and government,privatization,united states politics and government,elections,election issues",3,Christian Science Monitor,http://csmonitor.com
82889972,2012-06-17 11:50:09,"Breaking up violent West Side gangs took two years, multiagency effort",http://www.buffalonews.com/city/communities/west-side/article907400.ece,en,False,"police,drug abuse and traffic,crime and criminals,murders and attempted murders",57,The Buffalo News ,http://www.buffalonews.com/
87158513,2012-06-08 03:08:28,"Holder, congressman lock horns on gun-trafficking case",http://www.cleveland.com/nation/index.ssf/2012/06/post_120.html,en,True,"politics and government,united states politics and government,gun control,firearms",1641,cleveland.com,http://www.cleveland.com/
82105455,2012-05-27 04:09:06,Krug attacks!,http://www.nypost.com/p/news/opinion/opedcolumnists/krug_attacks_cv5ld2kSZ5DFnNMQcxt8aJ?utm_medium=rss&utm_content=OpedColumnists,en,False,"politics and government,biographical information,economic conditions and trends",7,New York Post,http://www.nypost.com/
82309151,2012-06-01 22:19:19,One murder charge dropped against U.S. soldier accused in Afghan killings,http://feeds.reuters.com/~r/reuters/topNews/~3/Cwnndch-1kc/us-usa-crime-afghanistan-idUSBRE8501D520120601,en,False,"politics and government,armament, defense and military forces,drug abuse and traffic,united states armament and defense,international relations",1089,Reuters ,http://www.reuters.com/
82348173,2012-06-01 23:31:04,Army drops one charge against soldier accused in Afghan massacre,http://feeds.chicagotribune.com/~r/chicagotribune/news/nationworld/~3/1tLj5WjvsGA/story01.htm,en,False,"politics and government,armament, defense and military forces,drug abuse and traffic,united states armament and defense,international relations",9,Chicago Tribune,http://www.chicagotribune.com/
82542100,2012-06-07 22:50:00,"Republicans clash with Attorney General Holder over voter ID laws, gun sting",http://feeds.washingtonpost.com/click.phdo?i=836a2ac3eca218ab71e7d85f2b35fb69,en,True,"privacy,politics and government,law and legislation,united states politics and government,elections,ethics",2,Washington Post,http://washingtonpost.com
82688490,2012-06-14 20:46:20,Republican won't seek rematch for Giffords' seat,http://feeds.foxnews.com/~r/foxnews/politics/~3/kVBEROtNAag/,en,True,"politics and government,united states politics and government,elections,legislatures and parliaments",1092,Fox News,http://www.foxnews.com/
87142381,2012-06-07 18:40:31,Republicans clash with AG on Fast and Furious,http://feeds.boston.com/click.phdo?i=cb2383d0df13223d69dc648a1c83566b,en,True,"politics and government,united states politics and government,firearms",15,The Boston Globe,https://www.bostonglobe.com/
87270652,2012-06-11 17:44:00,Poll: Giffords' aide leads in Ariz. election,http://rssfeeds.usatoday.com/~r/usatoday-NewsTopStories/~3/pAWgdF_eP9Q/1,en,False,"politics and government,united states politics and government,elections",4,USA Today,http://www.usatoday.com
82715520,2012-06-14 20:37:26,Republican won't seek rematch for Giffords' seat,http://www.sacbee.com/2012/06/14/4562818/republican-wont-seek-rematch-for.html#mi_rss=Wire%20Politics,en,True,"politics and government,united states politics and government,elections",26,Sac Bee,http://www.sacbee.com/
701544389,2012-06-12 17:27:46,Accused Tucson shooter's competency hearing rescheduled,https://www.reuters.com/article/us-usa-shooting-loughner/accused-tucson-shooters-competency-hearing-rescheduled-idUSBRE85B1IJ20120612,en,False,"politics and government,murders and attempted murders",4442,Reuters,http://www.reuters.com
1789434777,2012-06-17 00:00:00,"Read full transcripts of ""Face the Nation"" from 2012",https://www.cbsnews.com/news/face-the-nation-transcripts-2012/?ftag=,en,False,,1752,CBS News,http://www.cbsnews.com/
86340271,2012-07-20 12:49:46,Gunman kills 12 in Colorado movie theater,http://rss.cnn.com/~r/rss/cnn_mostpopular/~3/cY_UTnTUVcE/index.html,en,False,murders and attempted murders,1095,CNN,http://www.cnn.com/
86371262,2012-07-20 22:40:47,Warner Bros. Pulls ‘Gangster Squad’ Trailer from Internet After Shootings,http://feedproxy.google.com/~r/Mashable/~3/Vn0Bqd4d9r0/,en,False,motion pictures,5527,Mashable!,http://mashable.com
86358874,2012-07-20 21:32:09,Analysis: Colorado shooting unlikely to spur changes in gun laws,http://feeds.reuters.com/~r/reuters/topNews/~3/cT77nUpqPZ4/us-usa-shooting-guns-campaign-idUSBRE86J18M20120720,en,False,"politics and government,law and legislation,united states politics and government,gun control,firearms",4442,Reuters,http://www.reuters.com
86361538,2012-07-20 18:38:00,Security increased at theaters after shootings,http://www.ocregister.com/entertainment/movie-364721-theaters-security.html,en,True,"motion pictures,police",25,Orange County Register,http://www.ocregister.com/
86348310,2012-07-20 06:05:00,"Batman Movie Theater Shooting in Aurora, Colorado",http://newsfeed.time.com/2012/07/20/batman-movie-theater-shooting-in-aurora-colorado?xid=rss-igoogle,en,False,"no index terms from nytimes,fires and firefighters",4419,Time,http://time.com
86372434,2012-07-20 21:26:03,Colorado rampage claims woman who narrowly missed Toronto shooting,http://feeds.chicagotribune.com/~r/chicagotribune/news/nationworld/~3/_Qm88sEJZJk/story01.htm,en,False,motion pictures,9,Chicago Tribune,http://www.chicagotribune.com/
86348077,2012-07-20 16:50:10,"Colorado theater shooting suspect's apartment has 'sophisticated' bombs, police say",http://www.cleveland.com/nation/index.ssf/2012/07/colorado_theater_shooting_susp.html,en,True,,1641,cleveland.com,http://www.cleveland.com/
86355356,2012-07-20 14:30:05,What You Need To Know About the Batman Theater Shooting [UPDATES],http://feedproxy.google.com/~r/motherjones/main/~3/arkmAa29zDo/batman-theater-shooting-updates-dark-knight-rises,en,False,,1112,Mother Jones,http://www.motherjones.com/
86348095,2012-07-20 14:34:14,Paris Batman premiere cancelled after U.S. shooting,http://feeds.reuters.com/~r/reuters/entertainment/~3/yGytX4iD_8c/entertainment-us-usa-shooting-paris-idUSBRE86J0T720120720,en,False,"motion pictures,television",1089,Reuters ,http://www.reuters.com/
86348371,2012-07-20 15:33:10,South Florida patrons for Batman film undeterred by Colorado shootings,http://feedproxy.google.com/~r/sun-sentinel/news/local/palmbeach/~3/VmRf22u87Sc/story01.htm,en,False,motion pictures,39,South Florida Sun-Sentinel,http://www.sun-sentinel.com/
86109599,2012-07-12 03:58:31,Afghan massacre defendant to have court hearing in September,http://feeds.reuters.com/~r/Reuters/worldNews/~3/XMIzfTvWRWY/us-usa-afghanistan-soldier-idUSBRE86B03F20120712,en,False,"politics and government,united states politics and government,armament, defense and military forces,drug abuse and traffic,united states armament and defense,united states international relations,international relations",1089,Reuters ,http://www.reuters.com/
86347828,2012-07-20 11:40:37,"Mass shooting puts presidential campaign on hold, candidates mourn victims",http://feeds.foxnews.com/~r/foxnews/politics/~3/0949zB-zz5s/,en,False,"politics and government,united states politics and government,elections,presidents and presidency (us),presidential elections (us),election issues",1092,Fox News,http://www.foxnews.com/
86338999,2012-07-20 10:24:03,Police: 12 dead in Colorado theater shooting,http://www.arkansasonline.com/news/2012/jul/20/several-injured-possibly-dead-shooting-batman-prem/,en,True,murders and attempted murders,56,Arkansas Democrat-Gazette ,http://www2.arkansasonline.com/
86371300,2012-07-20 20:42:06,‘The Dark Knight Rises’ Screenings Go On,http://feedproxy.google.com/~r/Mashable/~3/Db_76ntezsc/,en,False,"motion pictures,theater",5527,Mashable!,http://mashable.com
86361256,2012-07-20 21:04:03,Presidential campaigns pause for condolences after shootings,http://rss.cnn.com/~r/rss/cnn_latest/~3/rweZc5z2XPY/index.html,en,False,"politics and government,united states politics and government,presidents and presidency (us),presidential elections (us)",1095,CNN,http://www.cnn.com/
86391829,2012-07-20 17:28:39,More Gun Violence,http://ireport.cnn.com/docs/DOC-817711?ref=feeds%2Foncnn,en,False,"politics and government,law and legislation,armament, defense and military forces,gun control,firearms",1095,CNN,http://www.cnn.com/
86348815,2012-07-20 16:20:14,"Condolences, calls for action among national reaction to deadly Colorado theater shooting",http://www.mercurynews.com/nation-world/ci_21120078/condolences-calls-action-among-national-reaction-deadly-colorado?source=rss,en,True,"united states politics and government,crime and criminals,murders and attempted murders",35,San Jose Mercury News,http://www.mercurynews.com/
85652897,2012-06-26 13:02:46,Accused Oikos University mass shooting suspect appears in court,http://www.mercurynews.com/crime-courts/ci_20935831/accused-oikos-university-mass-shooting-suspect-appears-court?source=rss,en,False,"education and schools,murders and attempted murders",35,San Jose Mercury News,http://www.mercurynews.com/
86352500,2012-07-20 15:03:50,Obama And Romney Respond To Colorado Tragedy,http://www.buzzfeed.com/gavon/obama-and-romney-respond-to-colorado-tragedy,en,False,"politics and government,united states politics and government",6218,Buzzfeed,http://www.buzzfeed.com
86363418,2012-07-20 17:24:00,"Questions, but few answers, in Colorado shooting; 12 dead, dozens hurt",http://feeds.latimes.com/~r/latimes/news/~3/SCb-9fZpRag/story01.htm,en,False,,6,LA Times,http://www.latimes.com/
86355924,2012-07-20 09:06:40,12 Killed in Mass Shooting at Batman Premiere in Colorado,http://feedproxy.google.com/~r/Mashable/~3/x9sKBteqbHo/,en,False,,5527,Mashable!,http://mashable.com
86355927,2012-07-20 13:00:29,Warner Bros. Issues Statement on ‘Dark Knight’ Theater Shooting,http://feedproxy.google.com/~r/Mashable/~3/paKrJzfIw-M/,en,False,"motion pictures,theater",5527,Mashable!,http://mashable.com
86368332,2012-07-20 14:33:00,"After Colorado theater shooting, Baltimore police to increase patrols around theaters",http://feeds.baltimoresun.com/~r/baltimoresun/entertainment/movies/rss2/~3/E45vDGrcczk/story01.htm,en,False,motion pictures,34,Baltimore Sun,http://www.baltimoresun.com/
86352743,2012-07-20 15:23:00,Paris Batman Premiere Canceled,http://feedproxy.google.com/~r/thedailybeast/articles/~3/8dGiQRsV7Os/batman-premiere-in-paris-canceled-after-colorado-shooting.html,en,False,motion pictures,1707,Daily Beast,http://www.thedailybeast.com/
86361079,2012-07-20 23:29:00,'Techie Computer Programmer Guy' And The Website Reddit Deliver The News,http://www.npr.org/blogs/alltechconsidered/2012/07/20/157133680/techie-computer-programmer-guy-and-the-web-site-reddit-deliver-the-news?ft=1&f=1003,en,False,"computers and the internet,motion pictures,news and news media",1096,NPR,http://www.npr.org/
86342206,2012-07-20 11:45:29,AP Top News at 7:54 a.m. EDT,http://feeds.foxnews.com/~r/foxnews/national/~3/YH-ox7gZOBc/,en,True,motion pictures,1092,Fox News,http://www.foxnews.com/
86370491,2012-07-20 20:51:00,Dark Knight Rises Shooting Suspect: Who Is James Holmes?,http://feeds.eonline.com/~r/eonline/topstories/~3/-81hlVDo0aA/dark-knight-rises-shooting-suspect-who-is-james-holmes,en,False,"motion pictures,firearms,murders and attempted murders",5856,E! Online,http://www.eonline.com/
86356016,2012-07-20 16:02:00,Colorado Mass Shooting Suspect Described As 'Recluse',http://www.npr.org/blogs/thetwo-way/2012/07/20/157100627/shooting-suspect-described-as-recluse?ft=1&f=1001,en,False,,1096,NPR,http://www.npr.org/
86348828,2012-07-20 12:49:57,"Police: At least 12 dead, 50 injured in Colorado theater shooting",http://www.mercurynews.com/nation-world/ci_21118873/police-14-dead-50-injured-colorado-theater-shooting?source=rss,en,True,motion pictures,35,San Jose Mercury News,http://www.mercurynews.com/
86350590,2012-07-20 15:07:51,HE BOOBY TRAPPED HIS HOME!,http://feeds.foxnews.com/~r/blogs/Gretawire/~3/P8zvzrljyEg/,en,False,"motion pictures,theater",1092,Fox News,http://www.foxnews.com/
86356030,2012-07-20 15:14:00,"President Obama: 'Such Violence, Such Evil is Senseless; It's Beyond Reason'",http://www.npr.org/blogs/thetwo-way/2012/07/20/157101106/president-obama-such-violence-such-evil-is-senseless-its-beyond-reason?ft=1&f=1001,en,False,"politics and government,united states politics and government",1096,NPR,http://www.npr.org/
86371405,2012-07-20 21:45:00,"The Tragedy of Jessica Ghawi: Spared In Toronto, She Died In Colorado Shooting",http://feedproxy.google.com/~r/NprProgramsATC/~3/lEJqR1josLY/the-tragedy-of-jessica-ghawi-spared-in-toronto-she-died-in-colorado-shooting,en,False,"terrorism,crime and criminals,murders and attempted murders",1096,NPR,http://www.npr.org/
86368293,2012-07-20 18:32:00,Harford police presence up at 'Dark Knight' screenings after Colorado shootings,http://feeds.baltimoresun.com/~r/baltimoresun/entertainment/movies/rss2/~3/hHM4Kgqy_EE/story01.htm,en,False,motion pictures,34,Baltimore Sun,http://www.baltimoresun.com/
86366843,2012-07-20 22:44:31,Batman shooter reportedly called himself 'The Joker',http://www.cleveland.com/nation/index.ssf/2012/07/batman_shooter_reportedly_call.html,en,True,motion pictures,1641,cleveland.com,http://www.cleveland.com/
86342202,2012-07-20 12:01:54,10 Things to Know for Friday,http://feeds.foxnews.com/~r/foxnews/national/~3/9PCSyjnpJAg/,en,True,,1092,Fox News,http://www.foxnews.com/
86367138,2012-07-20 15:23:00,Paris Batman Premiere Canceled,http://www.thedailybeast.com/articles/2012/07/20/batman-premiere-in-paris-canceled-after-colorado-shooting,en,False,motion pictures,1098,Newsweek ,http://www.newsweek.com/
86373714,2012-07-20 20:23:00,"A Litany Of Victims: Dispatch Tapes Reveal Chaos, Bloodshed Of Mass Shooting",http://www.npr.org/blogs/thetwo-way/2012/07/20/157123002/a-litany-of-victims-dispatch-tapes-reveal-chaos-bloodshed-of-mass-shooting?ft=1&f=1001,en,False,"recordings (audio),police",1096,NPR,http://www.npr.org/
86352541,2012-07-20 14:43:03,"Obama, Romney Pull Colorado Ads After Aurora Shooting",http://www.buzzfeed.com/zekejmiller/obama-pulls-colorado-negative-ads-after-aurora-sho,en,False,"politics and government,united states politics and government,advertising and marketing,elections,presidents and presidency (us),presidential elections (us),political advertising",6218,Buzzfeed,http://www.buzzfeed.com
86371335,2012-07-20 20:30:00,CelebBoutique Misguided Aurora Tweet Sparks Twitter Outrage,http://feedproxy.google.com/~r/Mashable/~3/Qj7vrP8bWFw/,en,False,computers and the internet,5527,Mashable!,http://mashable.com
