stories_id,publish_date,title,url,language,ap_syndicated,themes,media_id,media_name,media_url
599917523,2017-03-27 15:25:00,Suspects sought in deadly Cincinnati nightclub shooting,http://www.staradvertiser.com/2017/03/27/breaking-news/suspects-sought-in-deadly-cincinnati-nightclub-shooting/,en,True,,39573,HonululuAdvertiser,http://www.staradvertiser.com/
599917877,2017-03-27 15:55:58,The Latest: Officials Reveal Plans for Pulse Anniversary,https://www.usnews.com/news/best-states/florida/articles/2017-03-27/the-latest-officials-reveal-plans-for-pulse-anniversary,en,True,,1100,US News & World Report ,http://www.usnews.com/
599962841,2017-03-27 17:29:41,Inside UC's trauma center during the Cameo shooting,http://rssfeeds.cincinnati.com/~/285360844/0/cincinnati-news~Inside-UCs-trauma-center-during-the-Cameo-shooting/,en,False,,26590,cincinnati.com,http://cincinnati.com
600032419,2017-03-27 21:18:11,"No Arrests Made in Ohio Nightclub Shooting, Lack of Security Footage Hinders Probe",http://www.newsweek.com/ohio-ohio-nightclub-shooting-nightclub-shooting-guns-gun-violence-no-arrests-575015,en,False,,1098,Newsweek ,http://www.newsweek.com/
600326742,2017-03-28 10:24:39,"Sorting through Cameo chaos, District 4 fire chief 'has a job to do'",http://rssfeeds.cincinnati.com/~/285509278/0/cincinnati-news~Sorting-through-Cameo-chaos-District-fire-chief-has-a-job-to-do/,en,False,,26590,cincinnati.com,http://cincinnati.com
600757544,2017-03-29 05:52:21,Guilty plea set for woman in Sandy Hook parent threat,http://www.startribune.com/politics/national/417415613.html,en,True,,19,Star Tribune ,http://www.startribune.com/
600800046,2017-03-29 07:30:55,Guilty plea set for woman in Sandy Hook parent threat ,http://www.norwichbulletin.com/news/20170329/guilty-plea-set-for-woman-in-sandy-hook-parent-threat?rssfeed=true,en,False,,74242,norwichbulletin.com,http://www.norwichbulletin.com/#spider
600965399,2017-03-29 10:59:22,Woman charged in Sandy Hook parent threat a court no-show ,http://www.norwichbulletin.com/news/20170329/woman-charged-in-sandy-hook-parent-threat-court-no-show?rssfeed=true,en,False,,74242,norwichbulletin.com,http://www.norwichbulletin.com/#spider
597693451,2017-03-22 18:41:37,"Dallas Green, who managed Phillies to 1st title, dies at 82",http://www.chron.com/sports/article/Dallas-Green-who-managed-Phillies-to-1st-title-11020926.php,en,True,,10,houstonchronicle,http://www.chron.com/
602744508,2017-04-02 00:36:44,"April Showers Today - Shot at 70F Next Sunday - ""Tornado Amnesia""",http://www.startribune.com/blogs/417872283.html,en,False,,19,Star Tribune ,http://www.startribune.com/
602863235,2017-04-02 12:10:02,Quora Question: What Do We Misunderstand About Crime in America?,http://www.newsweek.com/crime-rate-misconceptions-america-gangs-577481,en,False,,1098,Newsweek ,http://www.newsweek.com/
603335551,2017-04-03 12:10:41,Woman charged in Sandy Hook parent threat arrested,http://www.startribune.com/nation/417976563.html,en,True,,19,Star Tribune ,http://www.startribune.com/
603624025,2017-04-03 15:10:29,Independent Lens paints intimate portrait of the Newtown community after the Sandy Hook killings,http://www.monstersandcritics.com/smallscreen/independent-lens-paints-portrait-of-the-newtown-community-after-the-sandy-hook-killings/,en,False,,38987,monstersandcritics,http://www.monstersandcritics.com/
603966884,2017-04-04 14:07:57,Suspect in Ohio nightclub shooting dies: police,http://feeds.reuters.com/~r/Reuters/domesticNews/~3/U4Um0xg22tE/us-usa-shooting-ohio-idUSKBN1762FC,en,False,,1089,Reuters ,http://www.reuters.com/
604285682,2017-04-05 07:00:00,Resolved: These are the resolutions actually passed by the Texas legislature,http://www.chron.com/news/politics/texas/article/Texas-legislature-resolutions-passed-11046977.php,en,False,,10,houstonchronicle,http://www.chron.com/
605067316,2017-04-06 13:24:09,Suspect charged with second murder in Ohio nightclub shooting,http://feeds.reuters.com/~r/Reuters/domesticNews/~3/D6AUoectpVk/us-usa-shooting-ohio-idUSKBN1782D6,en,False,,1089,Reuters ,http://www.reuters.com/
597715673,2017-03-22 20:07:50,"Dallas Green, who managed Phillies to 1st title, dies",http://www.foxnews.com/sports/2017/03/22/dallas-green-who-managed-phillies-to-1st-title-dies-at-82.html,en,True,,1092,Fox News,http://www.foxnews.com/
590616536,2017-03-07 15:44:15,What the Democrats running for governor candidates say about Rick Scott's speech,http://www.tampabay.com/blogs/the-buzz-florida-politics/what-the-democrats-governor-candidates-say-about-rick-scotts-speech/2315702,en,False,,22,Tampa Bay Times,http://www.tampabay.com/
664363926,2017-03-09 07:00:00,"Imam: There’s an atmosphere of intolerance that says, ‘That’s okay, that’s acceptable now’",https://www.washingtonpost.com/national/imam-theres-a-climate-of-hate-that-says-thats-okay-thats-acceptable-now/2017/03/09/127f4fd0-0434-11e7-ad5b-d22680e18d10_story.html?utm_term=.c26f9204abdd,en,False,,2,Washington Post,http://washingtonpost.com
602617617,2017-04-01 09:40:00,"Two men arrested, face charges in Ohio nightclub shooting",http://feeds.reuters.com/~r/reuters/USVideoLatest/~3/foO4Km_owbI/two-men-arrested-face-charges-in-ohio-ni,en,False,,1089,Reuters ,http://www.reuters.com/
593703388,2017-03-14 10:25:00,U.S. gives Florida nightclub shooting victims nearly $8.5 million,http://feeds.reuters.com/~r/reuters/topNews/~3/buhAG73ZWS8/us-orlando-shooting-vicitims-idUSKBN16L1SI,en,False,,1089,Reuters ,http://www.reuters.com/
601771831,2017-03-30 19:50:13,Two suspects charged in deadly Ohio nightclub shooting,http://feeds.reuters.com/~r/Reuters/domesticNews/~3/Ku4f6Lz0vwk/us-usa-shooting-ohio-idUSKBN1713D0,en,False,,1089,Reuters ,http://www.reuters.com/
601252312,2017-03-29 22:32:36,Police release chaotic 911 calls from Cameo nightclub shooting,http://rssfeeds.usatoday.com/~/285928218/0/usatodaycomnation-topstories~Police-release-chaotic-calls-from-Cameo-nightclub-shooting/,en,False,,4,USA Today,http://www.usatoday.com
594331486,2017-03-15 13:37:32,"Airport shooting suspect is being treated for schizophrenia, defense team says",http://feedproxy.google.com/~r/sun-sentinel/news/local/palmbeach/~3/T91FeHAZpHY/fl-reg-esteban-santiago-diagnosis-airport-shooting-20170313-story.html,en,False,,39,South Florida Sun-Sentinel,http://www.sun-sentinel.com/
591602691,2017-03-09 09:21:51,Why is that Sandy Hook group trying to revive their failed lawsuit?,http://hotair.com/archives/2017/03/09/why-is-that-sandy-hook-group-trying-to-revive-their-failed-lawsuit/,en,False,,117,Hot Air  ,http://hotair.com
601077349,2017-03-29 13:29:58,Armed man arrested on way to L.A. gay pride parade pleads not guilty,http://feeds.reuters.com/~r/Reuters/domesticNews/~3/Yfp7vLZHuw0/us-california-lgbt-arrests-idUSKBN1702LN,en,False,,1089,Reuters ,http://www.reuters.com/
597615346,2017-03-22 15:23:23,"Florida nightclub shooting victims sue gunman's employer, widow",http://feeds.reuters.com/~r/Reuters/domesticNews/~3/Vpo2ktlskvQ/us-orlando-shooting-lawsuit-idUSKBN16T2SI,en,False,,1089,Reuters ,http://www.reuters.com/
711904778,2017-03-27 17:30:24,"Monday's Mini-Report, 3.27.17",http://www.msnbc.com/rachel-maddow-show/mondays-mini-report-32717,en,False,,359084,Superglue: MSNBC,http://www.msnbc.com/#superglue
711883679,2017-03-28 19:26:16,"Tuesday's Mini-Report, 3.28.17",http://www.msnbc.com/rachel-maddow-show/tuesdays-mini-report-32817,en,False,,359084,Superglue: MSNBC,http://www.msnbc.com/#superglue
604469013,2017-04-05 12:29:12,Nightclub gunman's widow will be sent to face charges in Florida,http://feeds.reuters.com/~r/Reuters/domesticNews/~3/75iktjsq7Ho/us-orlando-shooting-idUSKBN17728O,en,False,,1089,Reuters ,http://www.reuters.com/
599311841,2017-03-26 07:01:02,UPDATE 1-UK minister says encryption on messaging services is unacceptable,http://feeds.reuters.com/~r/reuters/companyNews/~3/oKub8LZqUY8/britain-security-rudd-idUSL5N1H30AG,en,False,,1089,Reuters ,http://www.reuters.com/
597586171,2017-03-22 14:31:29,"Orlando nightclub attack: Survivors sue gunman&#8217;s wife, employer, saying massacre was preventable",http://www.mercurynews.com/2017/03/22/pulse-survivors-sue-gunmans-wife-employer-saying-the-massacre-was-preventable/,en,False,,35,San Jose Mercury News,http://www.mercurynews.com/
592204809,2017-03-10 18:14:41,Orlando nightclub gunman's widow ordered to remain jailed,http://feeds.reuters.com/~r/reuters/topNews/~3/L4N8uSPwguQ/us-orlando-shooting-idUSKBN16H2RO,en,False,,1089,Reuters ,http://www.reuters.com/
598190456,2017-03-23 00:17:36,From Fort Hood to Pulse nightclub: A list of homegrown terror in the U.S.,http://rssfeeds.usatoday.com/~/284298806/0/usatoday-newstopstories~From-Fort-Hood-to-Pulse-nightclub-A-list-of-homegrown-terror-in-the-US/,en,False,,4,USA Today,http://www.usatoday.com
594469842,2017-03-15 19:19:06,Arkansas Legislature Approves Measure to Expand Concealed Gun Carry,https://www.usnews.com/news/us/articles/2017-03-15/arkansas-legislature-approves-measure-to-expand-concealed-gun-carry,en,False,,1100,US News & World Report ,http://www.usnews.com/
597035236,2017-03-21 11:57:17,The Bigotry And Idiocy Of Donald Trump&#8217;s Favorite News Show,http://www.nationalmemo.com/bigotry-idiocy-donald-trumps-favorite-news-show/,en,False,,25363,National Memo,http://www.nationalmemo.com
597623770,2017-03-22 15:23:23,"Florida Nightclub Shooting Victims Sue Gunman's Employer, Widow",https://www.usnews.com/news/us/articles/2017-03-22/florida-nightclub-shooting-victims-sue-gunmans-employer-widow,en,False,,1100,US News & World Report ,http://www.usnews.com/
591029846,2017-03-08 12:35:55,Sandy Hook truther to plead guilty to harassing victim&#8217;s dad,http://nypost.com/2017/03/08/sandy-hook-truther-to-plead-guilty-to-harassing-victims-dad/,en,True,,7,New York Post,http://www.nypost.com/
600752748,2017-03-29 05:36:20,Guilty Plea Set for Woman in Sandy Hook Parent Threat,https://www.usnews.com/news/best-states/florida/articles/2017-03-29/guilty-plea-set-for-woman-in-sandy-hook-parent-threat,en,True,,1100,US News & World Report ,http://www.usnews.com/
599646046,2017-03-27 05:10:29,"Mass Shootings In US: List Of Gun Violence Incidents As Cincinnati Nightclub Shooting Kills 1, Injures 15",http://www.ibtimes.com/mass-shootings-us-list-gun-violence-incidents-cincinnati-nightclub-shooting-kills-1-2515397,en,False,,41550,IBTimes,http://www.ibtimes.com/
549753650,2017-03-12 08:00:00,Trump's Opponents Are Blaming Him For His Violent Chicago Campaign Event,https://www.buzzfeed.com/kyleblaine/trumps-opponents-are-blaming-him-for-his-violent-chicago-cam,en,False,,6218,Buzzfeed,http://www.buzzfeed.com
798093491,2017-03-06 19:46:06,"Conspiracy theories, attacks on the press, praise for tyrants, and more:",https://www.motherjones.com/politics/2017/03/creeping-authoritarianism-trump-trumpocracy-300/,en,False,,1112,Mother Jones,http://www.motherjones.com/
595456711,2017-03-17 17:59:47,A March Madness subtext: The Carolinas switch roles,https://www.washingtonpost.com/sports/colleges/a-march-madness-subtext-the-carolinas-switch-roles/2017/03/17/55c00c84-0b3d-11e7-a15f-a58d4a988474_story.html,en,False,,2,Washington Post,http://washingtonpost.com
598888667,2017-03-25 02:02:12,Denver Group Works to Help Cities Cope With Mass Shooting,https://www.usnews.com/news/best-states/colorado/articles/2017-03-25/denver-group-works-to-help-cities-cope-with-mass-shooting,en,True,,1100,US News & World Report ,http://www.usnews.com/
599929474,2017-03-27 16:18:50,Media Press FBI for Price It Paid for Tool to Unlock IPhone,https://www.usnews.com/news/best-states/california/articles/2017-03-27/media-press-fbi-for-price-it-paid-for-tool-to-unlock-iphone,en,True,,1100,US News & World Report ,http://www.usnews.com/
593243859,2017-03-13 12:15:00,"Airport shooting suspect is being treated for schizophrenia, defense team says",http://www.orlandosentinel.com/fl-reg-esteban-santiago-diagnosis-airport-shooting-20170313-story.html,en,False,,38,Orlando Sentinel,http://www.orlandosentinel.com/
594307372,2017-03-15 12:32:06,Library Named After Charleston Church Shooting Victim Tagged with Racist Graffiti: &#8216;Go Back to Hell Black Women&#8217;,http://www.eurweb.com/2017/03/645765/,en,False,,25336,eurweb,http://www.eurweb.com
593531528,2017-03-14 04:40:01,Obama's final year: US spent $36 million in records lawsuits,http://www.cnsnews.com/news/article/obamas-final-year-us-spent-36-million-records-lawsuits,en,True,,20357,CNS News,http://cnsnews.com
600409558,2017-03-28 13:34:26,"Teen&#8217;s Father Found out She Was Planning a School Shooting, Here’s What He Did",http://www.redstate.com/mwalsh8/2017/03/28/teens-father-found-planning-school-shooting-here%e2%80%99s/,en,False,,128,RedState,http://www.redstate.com
604427163,2017-04-05 12:31:03,Nightclub gunman&#8217;s widow will be sent to face charges in Florida,http://www.oann.com/nightclub-gunmans-widow-will-be-sent-to-face-charges-in-florida/,en,False,,127733,Oan,http://oann.com/
600554362,2017-03-28 19:40:08,"High School Girl, 18, Faces Charges For Plotting Massacre At School, Turned In By Dad",http://hollywoodlife.com/2017/03/28/girl-planning-school-shooting-arrested-dad-turned-in-catoctin-high-maryland/,en,False,,24621,hollywoodlife.com,http://hollywoodlife.com
599862118,2017-03-27 13:15:32,Lack of security video footage hampers Ohio shooting probe,http://www.oann.com/two-remain-critically-wounded-from-deadly-ohio-nightclub-shooting/,en,False,,127733,Oan,http://oann.com/
593852407,2017-03-14 16:04:30,Obama administration spent record $36 million in FOIA legal costs in final year,http://www.mlive.com/news/us-world/index.ssf/2017/03/obama_administration_spent_rec.html,en,True,,65422,mlive.com,http://mlive.com/
600773429,2017-03-29 05:50:00,"Guilty plea, sentencing expected today for woman charged with threatening Sandy Hook parrent",http://feedproxy.google.com/~r/sun-sentinel/news/local/~3/vBmHtQNfVng/fl-reg-sandy-hook-harassment-sentenced-20170328-story.html,en,False,,39,South Florida Sun-Sentinel,http://www.sun-sentinel.com/
592203101,2017-03-10 18:15:17,Orlando nightclub gunman&#8217;s widow ordered to remain jailed,http://www.oann.com/orlando-nightclub-gunmans-widow-ordered-to-remain-jailed/,en,False,,127733,Oan,http://oann.com/
686018572,2017-03-26 08:00:00,"Latest on Cameo nightclub shooting: Total hit up to 17, no security footage provided",http://www.cincinnati.com/story/news/local/2017/03/26/15-people-shot-1-killed-cincinnati-nightclub/99660812/?cookies=&from=global,en,False,,26590,cincinnati.com,http://cincinnati.com
603281475,2017-04-03 09:30:00,Woman accused of threatening Sandy Hook parent jailed after she was a no-show for court,http://www.sun-sentinel.com/fl-pn-sandy-hook-lucy-richards-arrest-20170403-story.html,en,False,,39,South Florida Sun-Sentinel,http://www.sun-sentinel.com/
597805531,2017-03-23 01:50:21,Rhodens hope poster sparks information about Ohio family massacre,http://rssfeeds.azcentral.com/~/284062653/0/phoenix/nation~Rhodens-hope-poster-sparks-information-about-Ohio-family-massacre/,en,False,,25128,AZCentral,http://www.azcentral.com
601178949,2017-03-29 21:47:18,Diary contains disturbing details on foiled school attack plot,http://www.cbsnews.com/news/diary-reveals-disturbing-new-details-in-foiled-plot-to-attack-school/,en,False,,1752,CBS News,http://www.cbsnews.com/
594403865,2017-03-15 16:15:28,Man accused of Fort Lauderdale mass shooting has mental illness but can stand trial,http://www.miamiherald.com/news/local/article138704713.html#storylink=rss,en,False,,28,Miami Herald,http://www.miamiherald.com/
597494580,2017-03-22 09:53:00," Nightclub shooting victims sue gunman's employer, wife",http://abcnews.go.com/US/wireStory/nightclub-shooting-victims-sue-gunmans-employer-wife-46298716,en,False,,39000,ABC News,http://abcnews.go.com/
599783060,2017-03-27 10:05:09,Two Remain Critically Wounded From Deadly Ohio Nightclub Shooting,https://www.usnews.com/news/us/articles/2017-03-27/two-remain-critically-wounded-from-deadly-ohio-nightclub-shooting,en,False,,1100,US News & World Report ,http://www.usnews.com/
592167632,2017-03-10 16:45:13,Wife of Killer in Orlando Mass Shooting To Be Detained Until Trial,http://www.ibtimes.com/wife-killer-orlando-mass-shooting-be-detained-until-trial-2506484,en,False,,41550,IBTimes,http://www.ibtimes.com/
593237577,2017-03-13 12:15:00,"Airport shooting suspect is being treated for schizophrenia, defense team says",http://feedproxy.google.com/~r/sun-sentinel/news/local/~3/9NejOtyd15s/fl-reg-esteban-santiago-diagnosis-airport-shooting-20170313-story.html,en,False,,39,South Florida Sun-Sentinel,http://www.sun-sentinel.com/
592227049,2017-03-10 19:32:38,Judge revokes bond for wife of nightclub shooter,http://www.ocregister.com/articles/salman-746251-judge-last.html,en,False,,25,Orange County Register,http://www.ocregister.com/
603239970,2017-04-03 08:30:36,Brandon woman jailed for missing court in Sandy Hook threats case,http://www.tampabay.com/news/publicsafety/crime/brandon-woman-jailed-for-missing-court-in-sandy-hook-threats-case/2318914,en,False,,22,Tampa Bay Times,http://www.tampabay.com/
600481945,2017-03-28 15:41:47,"Pastor of O'Bryan Spikes: 'Many people liked him if not, they loved him'",http://rssfeeds.cincinnati.com/~/285583140/0/cincinnati-news~Pastor-of-OBryan-Spikes-Many-people-liked-him-if-not-they-loved-him/,en,False,,26590,cincinnati.com,http://cincinnati.com
597531970,2017-03-22 10:28:00,"Orlando nightclub shooting victims sue gunman's employer, wife",http://www.chicagotribune.com/ct-orlando-nightclub-shooting-lawsuit-20170322-story.html,en,False,,9,Chicago Tribune,http://www.chicagotribune.com/
713037818,2017-03-14 06:48:10,Obama's Final Year: US Spent $36 Million in Records Lawsuits,http://www.Newsmax.com/Newsfront/Obama-US-Millions-Lawsuits/2017/03/14/id/778541,en,False,,25349,Newsmax,http://www.newsmax.com
594364040,2017-03-15 14:30:00,Death penalty decision in airport shootings suspect's case could take year or more,http://www.sun-sentinel.com/fl-reg-status-esteban-santiago-court-20170314-story.html,en,False,,39,South Florida Sun-Sentinel,http://www.sun-sentinel.com/
599924720,2017-03-27 15:17:00,Cincinnati police report progress in nightclub shooting investigation,http://feeds.chicagotribune.com/~r/chicagotribune/arts/~3/RtVJqDDrPwE/ct-cincinnati-nightclub-shooting-investigation-20170327-story.html,en,True,,9,Chicago Tribune,http://www.chicagotribune.com/
593527865,2017-03-14 03:52:39,Obama's final year: US spent $36 million in records lawsuits,http://www.sfgate.com/news/politics/article/Obama-s-final-year-US-spent-36-million-in-10999866.php,en,True,,14,SF Chronicle,http://www.sfgate.com/
601764661,2017-03-30 19:50:13,Two Suspects Charged in Deadly Ohio Nightclub Shooting,https://www.usnews.com/news/us/articles/2017-03-30/two-suspects-charged-in-deadly-ohio-nightclub-shooting,en,False,,1100,US News & World Report ,http://www.usnews.com/
604431274,2017-04-05 12:29:12,Nightclub Gunman's Widow Will Be Sent to Face Charges in Florida,https://www.usnews.com/news/us/articles/2017-04-05/nightclub-gunmans-widow-will-be-sent-to-face-charges-in-florida,en,False,,1100,US News & World Report ,http://www.usnews.com/
597009646,2017-03-21 13:07:15,Friend of South Carolina Church Shooter Gets Prison Time for Lying,https://www.usnews.com/news/us/articles/2017-03-21/friend-of-south-carolina-church-shooter-gets-prison-time-for-lying,en,False,,1100,US News & World Report ,http://www.usnews.com/
597462233,2017-03-22 09:51:36,"Nightclub Shooting Victims Sue Gunman's Employer, Wife",https://www.usnews.com/news/best-states/florida/articles/2017-03-22/nightclub-shooting-victims-sue-gunmans-employer-wife,en,True,,1100,US News & World Report ,http://www.usnews.com/
605048571,2017-04-06 13:24:09,Suspect Charged With Second Murder in Ohio Nightclub Shooting,https://www.usnews.com/news/us/articles/2017-04-06/suspect-charged-with-second-murder-in-ohio-nightclub-shooting,en,False,,1100,US News & World Report ,http://www.usnews.com/
602243181,2017-03-31 16:25:21,Student Charged in Alleged Plot for Mass Shooting at School,https://www.usnews.com/news/best-states/maryland/articles/2017-03-31/student-charged-in-alleged-plot-for-mass-shooting-at-school,en,True,,1100,US News & World Report ,http://www.usnews.com/
600626869,2017-03-29 00:00:00,Trump Administration&#x27;s Report On 2020 Census Is A Blow To LGBTQ Community,http://www.refinery29.com/2017/03/147543/trump-administration-2020-census-proposal-report?utm_source=feed&utm_medium=rss,en,False,,104698,Refinery29,http://www.refinery29.com
599946626,2017-03-27 17:20:42,Lincoln Road landmarks will be lit with rainbow colors to mark Miami Beach Gay Pride,http://www.miamiherald.com/news/local/community/gay-south-florida/article141084128.html#storylink=rss,en,False,,28,Miami Herald,http://www.miamiherald.com/
600908023,2017-03-29 06:54:21,"Orlando designates Pulse shooting anniversary as ""Orlando United Day""",http://mic.com/articles/172430/orlando-designates-pulse-shooting-anniversary-as-orlando-united-day,en,False,,109076,Mic,http://mic.com/
666027563,2017-04-04 08:00:00,"Big Pharma, on the personal","https://www.dailykos.com/stories/2017/04/04/1649924/-Big-Pharma,-on-the-personal",en,False,,115,Daily Kos,http://www.dailykos.com
855581163,2017-04-04 00:00:00,Second Cameo shooting victim dies,https://www.cincinnati.com/story/news/2017/04/04/second-cameo-shooting-victim-dies/100015032/,en,False,,26590,cincinnati.com,http://cincinnati.com
599948770,2017-03-27 17:25:32,"Cincinnati Cameo Nightclub Shooting Update: Liquor License Lost After 1 Dead, Multiple Injured",http://www.ibtimes.com/cincinnati-cameo-nightclub-shooting-update-liquor-license-lost-after-1-dead-multiple-2515883,en,False,,41550,IBTimes,http://www.ibtimes.com/
767407464,2017-03-30 11:05:00,Seal Beach mass shooting: State attorney general says he’ll seek death penalty against Scott Dekraai,https://www.ocregister.com/2017/03/30/seal-beach-mass-shooting-state-attorney-general-says-hell-seek-death-penalty-against-scott-dekraai/,en,False,,25,Orange County Register,http://www.ocregister.com/
855117800,2017-03-14 14:59:24,U.S. gives Florida nightclub shooting victims nearly $8.5 million,https://www.reuters.com/article/us-orlando-shooting-vicitims-idUSKBN16L1SI,en,False,,4442,Reuters,http://www.reuters.com
593625728,2017-03-14 11:51:24,Obama admin spent record $36M on lawsuits to keep info secret,http://www.cbsnews.com/news/obama-administration-spent-36m-on-records-lawsuits-last-year/,en,False,,1752,CBS News,http://www.cbsnews.com/
843862626,2017-03-14 23:55:09,Racists Vandalize Library Named For Victim Of Charleston Church Massacre,https://newsone.com/3694811/cynthia-hurd-library-named-for-emanuel-ame-church-massacre-victim-vandalized/,en,False,,24661,newsone.com,http://newsone.com
594443473,2017-03-15 18:01:17,"Husband targeted in veterinarian’s alleged murder plot fears for safety, lawyer says",http://www.chron.com/news/houston-texas/article/Husband-targeted-in-veterinarian-s-alleged-11004809.php,en,False,,10,houstonchronicle,http://www.chron.com/
599381955,2017-03-26 11:33:19,Cameo nightclub shooting in Cincinnati: What we know now,http://rssfeeds.cincinnati.com/~/285007695/0/cincinnati-home~Cameo-nightclub-shooting-in-Cincinnati-What-we-know-now/,en,False,,26590,cincinnati.com,http://cincinnati.com
664413796,2017-03-22 21:07:31,"At iPhone event, Tim Cook vows to protect your data",https://www.cnet.com/news/cook-vows-to-protect-your-data-at-apple-event/,en,False,,4415,CNET,http://cnet.com
852891858,2017-03-22 11:42:50,"Dylann Roof Friend Sentenced For Lying, Failing To Report Emanuel AME Shooting",https://newsone.com/3700384/judge-sentences-dylann-roof-friend-joey-meek-to-27-months-in-prison-charleston-church-shooting/,en,False,,24661,newsone.com,http://newsone.com
598207315,2017-03-23 09:00:00,‘The Carmichael Show’ Remains Topical but Sidesteps Trump in Season 3 ,http://feedproxy.google.com/~r/thr/television/~3/LtpHrHhkibo/carmichael-show-team-donald-trump-season-3-988172,en,False,,18496,Hollywood Reporter,http://www.hollywoodreporter.com
600067104,2017-03-28 00:01:05, Today in History ,http://www.chron.com/news/article/Today-in-History-11032149.php,en,True,,10,houstonchronicle,http://www.chron.com/
593451904,2017-03-14 00:00:00,"Tony Norman: Door-to-door Muslims, only in Canada",http://www.post-gazette.com/opinion/tony-norman/2017/03/14/Tony-Norman-Door-to-door-Muslims-Canada/stories/201703140086,en,False,,45,Pittsburgh Post-Gazette ,http://www.post-gazette.com/
598187833,2017-03-23 16:35:40,From Fort Hood to Pulse nightclub: A list of homegrown terror in the U.S.,http://rssfeeds.azcentral.com/~/284298806/0/phoenix/nation~From-Fort-Hood-to-Pulse-nightclub-A-list-of-homegrown-terror-in-the-US/,en,False,,25128,AZCentral,http://www.azcentral.com
590581899,2017-03-07 14:34:22,"Scott, Corcoran take shots at each other as Legislature convenes",http://www.miamiherald.com/news/politics-government/state-politics/article136952328.html#storylink=rss,en,False,,28,Miami Herald,http://www.miamiherald.com/
596630060,2017-03-20 19:06:05,YouTube still needs to actually apologize for (and fix) 'restricted mode',http://feedproxy.google.com/~r/Mashable/~3/Styt6PYXnzE/,en,False,,5527,Mashable!,http://mashable.com
663943007,2017-03-20 13:01:01,The Queerest Little Coffee Shop in LA,https://www.eater.com/2017/3/20/14961314/cuties-coffee-bar-los-angeles?utm_medium=email&utm_campaign=Sentences%203212017&utm_content=Sentences%203212017+CID_3b9ea5579ecc51d76bf6ddd0105caa9c&utm_source=cm_email&utm_term=Eater%20%20Meghan%20McCarron,en,False,,88260,eater.com,http://eater.com/#spider
598243219,2017-03-23 18:47:27,Final Day of Neil Gorsuch Confirmation Hearing Marked by Off-Stage Drama,https://www.usnews.com/news/politics/articles/2017-03-23/final-day-of-neil-gorsuch-confirmation-hearing-marked-by-off-stage-drama,en,True,,1100,US News & World Report ,http://www.usnews.com/
