stories_id,publish_date,title,url,language,ap_syndicated,themes,media_id,media_name,media_url,text
44241261,2011-11-10 17:26:04,Intern Who Helped Giffords After Shooting Elected to School Board,http://feeds.foxnews.com/~r/foxnews/politics/~3/qsDDz97ECbU/,en,False,"education and schools,politics and government,united states politics and government,elections",1092,Fox News,http://www.foxnews.com/,"This material may not be published, broadcast, rewritten,
      or redistributed. ©2021 FOX News Network, LLC. All rights reserved.
      Quotes displayed in real-time or delayed by at least 15 minutes. Market data provided by Factset. Powered and implemented by FactSet Digital Solutions. Legal Statement. Mutual Fund and ETF data provided by Refinitiv Lipper. In this Jan. 12, 2011 file photo, Daniel Hernandez Jr., center, who was with Rep. Gabrielle Giffords when she was shot, receives a standing ovation during President Obama's visit to speak in Tucson, Ariz., in the wake of the mass shooting. (AP) The congressional intern credited with helping save the life of Rep. Gabrielle Giffords will soon be an elected official himself. Daniel Hernandez Jr. was elected Tuesday to a seat on the school board for the Sunnyside Unified School District in Arizona. Hernandez gained national recognition after the January shooting of the Arizona congresswoman and 18 others outside a Tucscon grocery store. Hernandez kept pressure on Giffords' head and held her upright after the severe injury until she could receive medical attention. Hernandez later attended the State of the Union address as a guest of first lady Michelle Obama. He also sat next to the Obamas during the January memorial service in Arizona for the victims of the mass shooting. His campaign site mentioned his work with Giffords only briefly. Hernandez also worked on Hillary Clinton's presidential campaign in 2007. Hernandez won with 62 percent of the vote in Tuesday's election. His campaign site also stressed the importance of initiatives like ""all day kindergarten and making sure our graduates are workforce and college ready."" The 21-year-old told the Los Angeles Times that despite his many public appearances and interviews since the shooting, he didn't feel like he ""was doing anything concrete."" ""I wanted to find a way to do public service,"" he said. Get all the stories you need-to-know from the most powerful name in news delivered first thing every morning to your inbox Subscribed You've successfully subscribed to this newsletter! This material may not be published, broadcast, rewritten, or redistributed. ©2021 FOX News Network, LLC. All rights reserved. Quotes displayed in real-time or delayed by at least 15 minutes. Market data provided by Factset. Powered and implemented by FactSet Digital Solutions. Legal Statement. Mutual Fund and ETF data provided by Refinitiv Lipper.","This material may not be published, broadcast, rewritten,
      or redistributed. ©2021 FOX News Network, LLC. All rights reserved.
      Quotes displayed in real-time or delayed by at least 15 minutes. Market data provided by Factset. Powered and implemented by FactSet Digital Solutions. Legal Statement. Mutual Fund and ETF data provided by Refinitiv Lipper. In this Jan. 12, 2011 file photo, Daniel Hernandez Jr., center, who was with Rep. Gabrielle Giffords when she was shot, receives a standing ovation during President Obama's visit to speak in Tucson, Ariz., in the wake of the mass shooting. (AP) The congressional intern credited with helping save the life of Rep. Gabrielle Giffords will soon be an elected official himself. Daniel Hernandez Jr. was elected Tuesday to a seat on the school board for the Sunnyside Unified School District in Arizona. Hernandez gained national recognition after the January shooting of the Arizona congresswoman and 18 others outside a Tucscon grocery store. Hernandez kept pressure on Giffords' head and held her upright after the severe injury until she could receive medical attention. Hernandez later attended the State of the Union address as a guest of first lady Michelle Obama. He also sat next to the Obamas during the January memorial service in Arizona for the victims of the mass shooting. His campaign site mentioned his work with Giffords only briefly. Hernandez also worked on Hillary Clinton's presidential campaign in 2007. Hernandez won with 62 percent of the vote in Tuesday's election. His campaign site also stressed the importance of initiatives like ""all day kindergarten and making sure our graduates are workforce and college ready."" The 21-year-old told the Los Angeles Times that despite his many public appearances and interviews since the shooting, he didn't feel like he ""was doing anything concrete."" ""I wanted to find a way to do public service,"" he said. Get all the stories you need-to-know from the most powerful name in news delivered first thing every morning to your inbox Subscribed You've successfully subscribed to this newsletter! This material may not be published, broadcast, rewritten, or redistributed. ©2021 FOX News Network, LLC. All rights reserved. Quotes displayed in real-time or delayed by at least 15 minutes. Market data provided by Factset. Powered and implemented by FactSet Digital Solutions. Legal Statement. Mutual Fund and ETF data provided by Refinitiv Lipper."
44249756,2011-11-10 12:16:00,"Child abuse scandal claims jobs of university president, legendary coach",http://www.post-gazette.com/pg/11314/1188890-143.stm?cmpid=sports.xml,en,False,"education and schools,crime and criminals,ethics,sex crimes,college athletics,football,coaches and managers,suspensions, dismissals and resignations",45,Pittsburgh Post-Gazette ,http://www.post-gazette.com/
44276361,2011-11-10 16:34:09,Friends mourn Wal-Mart baseball bat attack victim ,http://feeds.latimes.com/~r/TheHomicideReport/~3/p8K8g9VxeJo/friends-mourn-wal-mart-baseball-bat-attack-victim-.html,en,False,"politics and government,crime and criminals",6,LA Times,http://www.latimes.com/,"The 74-year-old man who was beaten to death with a baseball bat in a brutal, unprovoked attack at a Lakewood Wal-Mart last week was a tireless advocate of off-road motorcycling, his friends and colleagues said. The attack occurred Nov. 1 when a transient, 47-year-old Richard Lawrence Kalfin, approached David Oakleaf in the store's sporting goods department and began beating him. Sheriff's officials said it did not appear Oakleaf had any warning of the attack. ""It’s one of the most brutal attacks I have ever seen,"" Sheriff's Lt. Ed Hernandez said at the time. In interviews with The Times, his friends said he was known as ""Daytona Dave""  and dedicated his time and  energies to the American Motorcyclist Assn., advocating for  off-road motorcycling interests as well. He was also an ambassador for  the sport in California, working out of the group's district office in  Glendale. ""Dave was a very active contributor and well-liked by his fellow    delegates. He was very   involved in local and state issues regarding  motorcycling,"" said AMA spokesman Pete Terhorst. ""His loss is a    terrible tragedy for the motorcycling community."" Clifford Cross, who co-owned a desert property and ran a business with Oakleaf, said he was stunned to learn of Oakleaf's death. ""I’m still in shock over it,"" Cross said of the friend with whom he enjoyed  a variety of outdoor pursuits, including off-road motorcycling,  fishing and hunting. ""Everybody liked him. He had so many friends."" In a statement posted on the AMA's website, Jim Geddes praised  Oakleaf as a mentor and tireless advocate who worked ""to protect  competitive and leisure trail riding throughout California."" ""Without the efforts of Dave, competitive dirtbike racing in Southern  California would surely be a thing of the past,"" Geddes wrote. ""For  that matter, every off roader who enjoys recreating on two stroke bikes  owes Dave a great debt of gratitude.""  Oakleaf gained a  reputation for being an aggressive advocate for the cause. ""The off roading community was faced with very strict emission  requirements that would banish all two stroke bikes manufactured after  1997 off of public lands,"" Geddes wrote. ""Working with other  stakeholders and agency personnel, Dave would not sign off the plan  until they worked out what is currently referred to as the 'red sticker'  program. Thanks to his efforts, bikes with red stickers can compete in  any sanctioned off road event, and can trail ride during certain times  of the year throughout Southern California."" Oakleaf moved to the Long Beach area 45 years ago from upstate New  York. He took a job with the Los Angeles County's Department of Public  Social Services in El Monte. He retired 20 years ago. One of his former colleagues, Eileen Ritchie, described Oakleaf as a  kind and tenderhearted man. She recalled instances in which he cared for an  Irish setter and her pup after the adult canine was struck by a car on  the freeway. Another time he found an injured owl in the desert and  wrapped a T-shirt around his motorcycle handlebars so the bird could grip while he  drove to a raptor rescue center. The bird later recovered. Ritchie said his death was especially hard because her other friend  Lucia Kondas, who also worked with Oakleaf, was one of the victims in  last month's mass shooting in Seal Beach. ""It's cruel that two truly kind and nice people have been taken away from us by these violent acts,"" Ritchie said. RELATED: Fatal Wal-Mart attack completely random, police say 74-year-old fatally beaten with baseball bat inside Walmart -- Andrew Blankstein (Twitter.com/anblanx) Phto: A Wal-Mart store in Lakewood was the site of a fatal baseball bat attack. Credit: KTLA","The 74-year-old man who was beaten to death with a baseball bat in a brutal, unprovoked attack at a Lakewood Wal-Mart last week was a tireless advocate of off-road motorcycling, his friends and colleagues said. The attack occurred Nov. 1 when a transient, 47-year-old Richard Lawrence Kalfin, approached David Oakleaf in the store's sporting goods department and began beating him. Sheriff's officials said it did not appear Oakleaf had any warning of the attack. ""It’s one of the most brutal attacks I have ever seen,"" Sheriff's Lt. Ed Hernandez said at the time. In interviews with The Times, his friends said he was known as ""Daytona Dave""  and dedicated his time and  energies to the American Motorcyclist Assn., advocating for  off-road motorcycling interests as well. He was also an ambassador for  the sport in California, working out of the group's district office in  Glendale. ""Dave was a very active contributor and well-liked by his fellow    delegates. He was very   involved in local and state issues regarding  motorcycling,"" said AMA spokesman Pete Terhorst. ""His loss is a    terrible tragedy for the motorcycling community."" Clifford Cross, who co-owned a desert property and ran a business with Oakleaf, said he was stunned to learn of Oakleaf's death. ""I’m still in shock over it,"" Cross said of the friend with whom he enjoyed  a variety of outdoor pursuits, including off-road motorcycling,  fishing and hunting. ""Everybody liked him. He had so many friends."" In a statement posted on the AMA's website, Jim Geddes praised  Oakleaf as a mentor and tireless advocate who worked ""to protect  competitive and leisure trail riding throughout California."" ""Without the efforts of Dave, competitive dirtbike racing in Southern  California would surely be a thing of the past,"" Geddes wrote. ""For  that matter, every off roader who enjoys recreating on two stroke bikes  owes Dave a great debt of gratitude.""  Oakleaf gained a  reputation for being an aggressive advocate for the cause. ""The off roading community was faced with very strict emission  requirements that would banish all two stroke bikes manufactured after  1997 off of public lands,"" Geddes wrote. ""Working with other  stakeholders and agency personnel, Dave would not sign off the plan  until they worked out what is currently referred to as the 'red sticker'  program. Thanks to his efforts, bikes with red stickers can compete in  any sanctioned off road event, and can trail ride during certain times  of the year throughout Southern California."" Oakleaf moved to the Long Beach area 45 years ago from upstate New  York. He took a job with the Los Angeles County's Department of Public  Social Services in El Monte. He retired 20 years ago. One of his former colleagues, Eileen Ritchie, described Oakleaf as a  kind and tenderhearted man. She recalled instances in which he cared for an  Irish setter and her pup after the adult canine was struck by a car on  the freeway. Another time he found an injured owl in the desert and  wrapped a T-shirt around his motorcycle handlebars so the bird could grip while he  drove to a raptor rescue center. The bird later recovered. Ritchie said his death was especially hard because her other friend  Lucia Kondas, who also worked with Oakleaf, was one of the victims in  last month's mass shooting in Seal Beach. ""It's cruel that two truly kind and nice people have been taken away from us by these violent acts,"" Ritchie said. RELATED: Fatal Wal-Mart attack completely random, police say 74-year-old fatally beaten with baseball bat inside Walmart -- Andrew Blankstein (Twitter.com/anblanx) Phto: A Wal-Mart store in Lakewood was the site of a fatal baseball bat attack. Credit: KTLA"
43446592,2011-10-23 20:40:38,Gabrielle Giffords to undergo 'intensive' therapy in North Carolina,http://rss.cnn.com/~r/rss/cnn_latest/~3/kvcgZngNv9s/index.html,en,False,medicine and health,1095,CNN,http://www.cnn.com/,"By the CNN Wire Staff  Updated 2040 GMT (0440 HKT) October 23, 2011"
764377850,2011-10-16 05:50:00,Laura Webb: She was shot while doing her mother’s hair,https://www.ocregister.com/2011/10/16/laura-webb-she-was-shot-while-doing-her-mothers-hair/,en,False,murders and attempted murders,25,Orange County Register,http://www.ocregister.com/,"Trending:  Laura Webb-Elody  A photo of Laura Webb-Elody was recently added to the memorial at Salon Meritage.  A note of gratitude is left for  Laura Webb-Elody at the Salon Meritage memorial in Seal Beach.  A note of remembrance is left for Laura Webb-Elody  outside the salon among the thousands of flowers.  A note that reads in part, ""To my Dearest Friend Laura Webb - I will love and miss you all the days of my life...Remember we are ""sisters. "" was taped to the outside of Salon Meritage.  A tribute to stylist Laura Webb-Elody was left at the memorial outside  Salon Meritage.  A note of sorrow was left at the memorial for Salon Meritage stylist Laura Webb-Elody.  A note to Laura Webb-Elody that reads, ""Dearest Laura, I will always miss your laughter, Love, Melinda"" , sits on a windowsill at Salon Meritage.  A photograph of Laura Webb-Elody was taped to the windows of Salon Meritage.  Laura Webb-elody was with family when she was shot. Her mother, Hattie Stretz, was in the salon, getting her hair done by her daughter, when the shooting took place. Stretz, 73, also was shot during the attack. Authorities said Thursday that Stretz's condition is improving and she is expected to survive.  The memorial for the victims of Wednesday's mass shooting has expanded greatly and wraps around the building at Salon Meritage.  Photographs of the victims of Wednesday mass shooting are beginning to be added to the memorial at Salon Meritage, including these of Laura Webb-Elody giving young clients their first haircuts. Webb-Elody was with family when she was shot. Her mother, Hattie Stretz, was in the salon, getting her hair done by her daughter, when the shooting took place. Stretz, 73, also was shot during the attack. Authorities said Thursday that Stretz's condition is improving and she is expected to survive.  A floral wreath in honor of Laura Webb-Elody was recently hung on the windows of Salon Meritage.  It was about 3 p.m. Wednesday when Patricia Eskenazi’s phone began blasting. She didn’t know it, but she was getting news – again and again – about a mass shooting that took eight people, including her friend and hairstylist, Laura Webb. “I’m so sad. I’m probably in shock more than anything, said Eskenazi, 74, president of the Los Alamitos Seal Beach Rotary Club. “I know it has happened, but I still don’t believe it.” Webb, who turned 46 this month, was Eskenazi’s hairstylist for the past 12 years. Police identified her as Laura Lee Elody, but Webb was married about nine months ago and used her married name. Webb was with family when she was shot. Her mother, Hattie Stretz, was in the salon, getting her hair done by her daughter, when the shooting took place, Eskenazi said. Stretz, 73, also was shot during the attack. Authorities said Thursday that Stretz’s condition is improving and she is expected to survive. Eskenazi remembers Webb being a big movie buff, a motorcycle rider and a “nice young lady.” “She was one of those happy people … never got angry and was a very nice person.” Eskenazi added that Webb was creative and seemed to enjoy her work. “Whenever you wanted to do something different, she would help you achieve that. “She had quite a following.” The hairdressers at Salon Meritage were a close-knit group who spent time together outside of work. Eskenazi said the salon owner, Randy Fannin, would throw Christmas parties for his staff. “He (Scott Dekraai) took all these innocent lives … It’s terrible that he killed his ex-wife, then he took all these people with him,” Eskenazi said. Eskenazi remembers seeing Stretz, who has two other daughters and a son, at a recent Casino Night event at the Los Alamitos Youth Center. “She was pretty involved,” Eskenazi said. “Hattie liked to travel to different places and was involved with schools.” Contact the writer: amolina@ocregister.com or 714-704-3794 Get the latest news delivered daily! We invite you to use our commenting platform to engage in insightful conversations about issues in our community. Although we do not pre-screen comments, we reserve the right at all times to remove any information or materials that are unlawful, threatening, abusive, libelous, defamatory, obscene, vulgar, pornographic, profane, indecent or otherwise objectionable to us, and to disclose any information necessary to satisfy the law, regulation, or government request. We might permanently block any user who abuses these conditions. If you see comments that you find offensive, please use the “Flag as Inappropriate” feature by hovering over the right side of the post, and pulling down on the arrow that appears. Or, contact our editors by emailing moderator@scng.com."
914205338,2011-11-01 00:00:00,"Breaking News, Analysis, Politics, Blogs, News Photos, Video, Tech Reviews - TIME.com","http://content.time.com/time/nation/article/0,8599,2041408,00.html",,False,,4419,Time,http://time.com,"A medical helicopter evacuates victims from an event in Tucson, Ariz., where 19 people were shot and U.S. Representative Gabrielle Giffords was seriously wounded. Follow @TIME Updated: 12:25 a.m. Sometimes, rumors of violence beget actual violence. Saturday's mass shooting at a Safeway on North Oracle Road in Tucson, which killed six and left Democratic Congresswoman Gabrielle Giffords and others gravely wounded, may well be one of those occasions. It's impossible to know this early what the motivations for the attack were. Was the alleged shooter — who has been identified as 22-year-old Tucsonan Jared Loughner — angry about immigration? Or perhaps another hot-button issue? YouTube videos ascribed to him bore the mark of mental illness — they were conspiratorial, unintelligible, espousing no particular cause — but no matter his mental state, his crime took place in an overheated political environment. Last March, at the height of the health care reform battle, Giffords' office was vandalized. She mentioned in an MSNBC interview that a Sarah Palin graphic had depicted her district in the crosshair of a gun sight. ""They've got to realize there are consequences to that,"" she said. ""The rhetoric is incredibly heated."" The corner next to her office had also become, she said, a popular spot for Tea Party protests. (See ""40 Under 40: The Rising Stars of American Politics."") As Pima County Sheriff Clarence Dupnik put it in an extraordinary and melancholic press conference after the shooting, ""we have become the Mecca for prejudice and bigotry."" He added that he's ""not aware of any public officials who are not receiving threats."" Another shooting victim, a federal judge named John Roll, had been placed under 24-hour security in 2009 after ruling in favor of illegal immigrants in a high-profile case. It's unclear why he was at the supermarket event. But for almost a year now, Arizona's leaders have been grappling with anti-immigration sentiments, inflamed by reports of crossborder violence. National media attention, with its attendant voices of hysteria, only added to the churn. Pundits spoke gravely about a wave of violence, born in Mexico and now flooding Arizona. Arizona's two most famous politicians fueled the fury. Republican Senator John McCain, facing an unexpected reelection challenge from the right, ran a campaign obsessed with crossborder crime. And GOP Governor Jan Brewer, who invited the national spotlight by championing strict anti-illegal immigrant legislation, talked of beheadings in the desert. The only problem with all this talk about a massive crossborder crime wave is that it wasn't true. Phoenix had not become one of the world's kidnapping capitals. Crime rates in Arizona had been steady or even fallen in some areas. There had been no beheadings in the desert. There were plenty of deaths there, but they were pathetic and meek tragedies: impoverished border-crossers, abandoned by their heartless guides, dying of exposure and dehydration. (See the top 10 American political prodigies.) But the idea of a state under siege took hold. When I was on the border last year reporting on the murder of rancher Rob Krentz, I talked to many who sincerely believed that they were under attack. Krentz's murder was a terrible event, but it was an isolated event. The relatively small number of home invasions, holdups and other crimes deeply disturbed border communities, but only because they had been living in such calm for so long. Their crime rates still don't match most cities in the states. The supermarket meet-and-greet where Giffords was shot was actually a testimony to just how safe southern Arizona is. As a press release from her office last week put it, ""'Congress on Your Corner' allows residents of Arizona's 8th Congressional District to meet their congresswoman one-on-one and discuss with her any issue, concern or problem involving the federal government."" Not exactly the kind of event a politician would hold in a war zone. (See TIME's complete coverage of the Tucson shooting.) It's true that Giffords was not a fan of the state's anti-immigration bill SB1070, but there were higher-profile opponents, such as her fellow Congressional Representative in Tuscon, Raul Grijalva. Yet the idea that Arizona is under attack has been pushed hard enough that it's very possible that the coward who shot her (in the head, according to a Tucson paper) believed that the 40-year-old Democrat, who had been tarred by some as soft on immigration because she didn't support SB1070, was contributing to larger-scale violence against Arizonans. If that is the case, it would only add to the tragedy. The fact is, that among all the overwrought promises and all the panic I heard last summer in Arizona, I found that Giffords was one of the few politicians offering concrete law enforcement steps that would actually work against the drug cartels and other smugglers. It's not just that she fought for more money and police for border protection, although she did that. She co-sponsored legislation last year with a California Republican that aimed to give law enforcement important new tools in cracking down on the cash cards that were a favored methods of money-laundering. It was one of the many sensible, pragmatic ideas she had for cracking down on crime. Whatever dark fantasies drove someone to try to take her life, Giffords is a sensible politician who was likely shot because she dealt with Arizona's reality, not its rumors. See the top 10 campaign ads of 2010. See TIME's most unforgettable images of 2010."
