stories_id,publish_date,title,url,language,ap_syndicated,themes,media_id,media_name,media_url,text
41451835,2011-09-11 03:15:00,American Muslims work to build awareness,http://www.kansascity.com/2011/09/10/3133494/american-muslims-work-to-build.html#storylink=rss,,False,,30,Kansas City Star,http://www.kansascity.com/
41466073,2011-09-11 15:04:30,"In post-9/11 America, complex new realities",http://www.buffalonews.com/911/article552525.ece,,False,,57,The Buffalo News ,http://www.buffalonews.com/,"We recognize you are attempting to access this website from a country belonging to the European Economic Area (EEA) including the EU which
            enforces the General Data Protection Regulation (GDPR) and therefore access cannot be granted at this time.
            
                For any issues, call (800) 777-8640."
41474520,2011-09-11 17:39:00,Nevada Guard to honor comrades killed in shooting,http://www.kansascity.com/2011/09/11/3134988/nevada-guard-to-honor-comrades.html#storylink=rss,,False,,30,Kansas City Star,http://www.kansascity.com/
41496205,2011-09-12 01:29:39,More bullying cases have parents turning to courts,http://rssfeeds.usatoday.com/~r/usatoday-NewsTopStories/~3/0pODvN3dmes/1,,False,"education and schools,suits and litigation",4,USA Today,http://www.usatoday.com
41649908,2011-09-15 07:08:00,"$20,000 reward offered for mass shooting info",http://www.miamiherald.com/2011/09/15/2407912/20000-reward-offered-for-mass.html,,False,,28,Miami Herald,http://www.miamiherald.com/
41724539,2011-09-16 16:48:00,Montana asbestos victims win $43M settlement,http://www.miamiherald.com/2011/09/16/2410324/montana-asbestos-victims-win-43m.html,,False,,28,Miami Herald,http://www.miamiherald.com/
41728889,2011-09-16 19:54:43,Spokeswoman says no shooting at Tucson base,http://www.sacbee.com/2011/09/16/3915834/tucsons-davis-monthan-air-force.html#mi_rss=Wire%20National%20News,,False,,26,Sac Bee,http://www.sacbee.com/
42384271,2011-09-30 12:27:19,US official: al-Awlaki dead in US attack in Yemen,http://www.sacbee.com/2011/09/30/3950198/us-intelligence-support-claim.html#mi_rss=Wire%20National%20News,,False,,26,Sac Bee,http://www.sacbee.com/
42386952,2011-09-30 13:10:17,"US officials: al-Qaida cleric al-Awlaki, linked to attacks on Americans, killed in Yemen",http://feeds.washingtonpost.com/click.phdo?i=485a7c227bfc77504b4a91adf44b9cbb,,False,"politics and government,united states politics and government,recordings (audio),armament, defense and military forces,terrorism,crime and criminals,united states armament and defense,united states international relations,international relations,airlines and airplanes,world trade center (nyc),office buildings and commercial properties,hijacking",2,Washington Post,http://washingtonpost.com,
42632963,2011-10-05 20:28:00,"Colo school shooting verdict: not guilty, insanity",http://www.miamiherald.com/2011/10/05/2440308/colo-school-shooting-verdict-not.html,,False,,28,Miami Herald,http://www.miamiherald.com/
42633857,2011-10-05 20:23:00,"Colo school shooting verdict: not guilty, insanity",http://www.kansascity.com/2011/10/05/3189202/colo-school-shooting-verdict-not.html#storylink=rss,,False,,30,Kansas City Star,http://www.kansascity.com/
42649698,2011-10-06 03:44:07,Suspect remains at large after deadly shooting spree,http://www.sacbee.com/2011/10/05/3963890/suspect-remains-at-large-after.html#mi_rss=Wire%20Lifestyle,,False,,26,Sac Bee,http://www.sacbee.com/
42710459,2011-10-07 06:11:22,Giffords attends husband's retirement ceremony,http://rssfeeds.usatoday.com/~r/usatoday-NewsTopStories/~3/CdVDPh1_KsA/1,,False,,4,USA Today,http://www.usatoday.com
42710460,2011-10-06 21:23:00,Giffords attends White House event for husband,http://rssfeeds.usatoday.com/~r/usatoday-NewsTopStories/~3/nqrxbzJ53To/1,,False,,4,USA Today,http://www.usatoday.com,"The White House welcomed a very special guest this afternoon: Rep. Gabrielle Giffords, D-Ariz., a little less than nine months after her near-fatal wounding in the Tucson mass shooting. The Arizona lawmaker attended a retirement ceremony for her husband, ex-astronaut and Navy Capt. Mark Kelly. ""As vice president I get to work with an awful lot of people who devote their lives day to day to public service,"" Vice President Joe Biden said. ""But  it's not everyday you encounter examples of sheer, sheer courage,  selflessness and dedication, like you see in this couple."" A pool report said ""Giffords wore glasses, black pants and running shoes. She also wore a  brace on her right hand."" ""She smiled as she came in,"" the pool report said. ""Her hair is still  short but has grown out a little since her Aug. 1 vote on the debt  ceiling. She sat in the front row ... She stood up  on her own for the pledge of allegiance and invocation, which was  delivered by the Rev. Patrick Conroy, who is the House chaplain. ""Our nation has gained in the gift of self from this great citizen,"" Conroy said. Here is more from the pool report by Stephanie Innes of the Arizona Daily Star: Pool was escorted into the Secretary of War Suite in the Eisenhower Executive Office Building at approximately 12:45 p.m. Approximately 50 guests were seated in the room, which is decorated with the first U.S. flag to fly over Paris after the liberation at the end of World War II. Guests included NASA Administrator Charles F. Bolden, Under Secretary of the Army Joseph William Westphal and Vice-Chief of Naval Operations Admiral Mark E. Ferguson. House Minority Leader Nancy Pelosi sat in the front row, House Minority Whip Steny Hoyer, Sen. Kirsten Gillibrand, U.S. Reps. Debbie Wasserman Schultz, Adam Smith, Erik Paulsen and Pete Olson as well as retired U.S. Rep. Ike Skelton. The ceremony began at 1:40 p.m.  Biden later apologized for the late start, explaining he had been visiting with Kelly and his family in the West Wing. Kelly came in with his family, including daughters Claudia and Claire Kelly, mother Patricia Kelly, Giffords and Giffords' mother Gloria Giffords. There was prolonged applause when they came in. Giffords entered the room with her chief of staff Pia Carusone. ... One of his daughters helped award Kelly the Legion of Merit, and Biden helped pin it on his jacket twice since it came loose the first time. The Legion of Merit was established by Congress in 1942 to recognize members of the armed services who demonstrator, ""exceptionally meritorious conduct in performing outstanding services."" Giffords got up on her own to help present her husband with the Distinguished Flying Cross medal, which he earned for commanding the fourth and final flight on the space shuttle Endeavour. She pinned it on his jacket with her left hand. Biden commented that she did a better job with the pinning than he did. Biden said he was honored to officially retire Kelly. He said Kelly and Giffords had requested he perform the ceremony. He said Kelly's daughters, who are 16 and 14, are both very bright and beautiful and joked that they should not be allowed to date until they are 30. ""Mark I hope to hell you have big guard dogs,"" Biden said. He introduced Kelly's mother and Giffords' mother. Giffords waved and smiled at both women. As Biden introduced individual guests, Giffords looked at each one, smiled, waved and blew some air kisses. ... He said Kelly has, ""commendations galore,"" including top decorations given by the Pentagon and NASA. He noted that service is a Kelly family tradition. Both of Kelly's parents were police officers and Kelly's identical twinbrother, Scott is also an astronaut. He spoke directly to Kelly, saying that after he graduated from the United States Merchant Marine Academy with highest honors, ""you knew you wanted to fly,"" and he became a naval aviator. He said that Kelly flew 39 combat missions on two deployments during Operation Desert Storm on the USS Midway with the U.S. Navy. ""Then came the opportunity to fly higher and you took it,"" Biden said. ""The Navy lent you to the NASA astronaut corps in 1996."" Biden said Kelly did his job with ""humility and humor."" On one shuttle mission that included the task of repairing a faulty toilet at the International Space Station, Kelly, ""floated through the airlock and said, 'I understand you are looking for a plumber.' And one hell of a plumber you were."" He commended Kelly for leading the Endeavour space shuttle in May and spoke directly to Giffords, saying she is an inspiration to thousands of people who suffer from traumatic brain injuries. ""I don't use the word loosely. You are an inspiration. You've been inspirational, people looking, saying 'I can make it, I can do this,'"" Biden said. He thanked Kelly for being devoted to his nation and his family. ""You have spoken to the whole country,"" he said. Kelly was the final speaker. He said it has ""truly meant a lot to us,"" to have so many people ""in our corner"" during the last eight months. ""Gabby and I want to thank you for your boundless friendship and optimism as our family has traveled this road over the last eight months,"" he said. Kelly said there is no greater friend and no worse foe than the U.S. Navy. ""Thank you for giving me the opportunity to fly in space not just once but four times,"" he said. ""NASA is the example of scientific research, development and success and must remain a permanent part of the fabric of this great country."" Kelly gave flowers to his daughters and to Giffords. He gave Giffords a bouquet of pink tulips. ""Gabby, you remind me everyday to deny the acceptance of failure,"" Kelly said. ""I look forward to the next phase of our life together and watching all of your future achievements."" The pool was escorted out of the ceremony at 2:15 p.m.. A private reception with family was held with crackers and cheese, sandwiches and dessert. David's journalism career spans three decades, including coverage of five presidential elections, the Oklahoma City bombing, the 2000 Florida presidential recount and the 9/11 terrorist attacks. He has covered the White House for USA TODAY since 2005. His interests include history, politics, books, movies and college football -- not necessarily in that order. More about David Follow the Oval on Twitter: @The Oval, @djusatoday. Also contributing to the Oval: Richard Wolf @richardjwolf; Aamer Madhani @AamerISmad Subscribe to The Oval via RSS Sign up for The Oval e-mail alerts Delivered by FeedBurner"
42387722,2011-09-30 09:02:31,Al Qaeda's Anwar al-Awlaki killed in Yemen,http://feeds.cbsnews.com/~r/CBSNewsWorld/~3/AquXpebG7AI/main20113732.shtml,,False,"politics and government,united states politics and government,armament, defense and military forces,terrorism,united states armament and defense,united states international relations,international relations",1752,CBS News,http://www.cbsnews.com/,"Watch CBSN Live The page may have been removed, had its name changed, or is just temporarily unavailable. On ""The Takeout"" podcast this week, the chair of the House Progressive Caucus joined Major Garrett to talk about the fate of two bills containing much of Biden's agenda. The controversial measure, which was debated for ten hours, now goes to the state Senate. Critics called it discriminatory. Because of a court order, the Biden administration is required to reinstate the Trump-era policy of requiring asylum-seekers to wait in Mexico for their hearings. The state has set a goal to replace all of Benton Harbor's lead service lines within 18 months. In a recent survey, 54% of delivery workers — many of them immigrants — reported being robbed. An FDA advisory panel unanimously voted to recommend Moderna's COVID-19 vaccine booster six months after initial vaccination for vulnerable Americans. Those included in the recommendation are people ages 65 and older, adults with underlying health conditions and those with an increased risk of contracting the virus due to their job. Dr. Shad Marvasti, the director of public health, prevention and promotion and an associate professor at the University of Arizona College of Medicine Phoenix, joins CBSN to discuss the latest. The four-term mayor of Buffalo, New York, lost the Democratic primary race to a Socialist community organizer. Now Mayor Byron Brown is hoping to stay in office by winning via write-in campaign. Assistant professor of political science at the University at Buffalo Shawn Donahue joins CBSN's ""Red & Blue"" anchor Elaine Quijano with the details. The decision deals a blow to abortion rights advocates, who had hoped to pause the law for as long as possible while it is litigated. A spokesperson for the former president said his illness is unrelated to COVID. The former pilot who led Boeing's 737 Max technical team allegedly deceived safety regulators. The amount of crude oil spilled in an offshore pipeline leak is estimated to be one-fifth of what officials initially feared, a Coast Guard official said. Biden to promote his agenda in Connecticut Friday; Global emissions not dropping fast enough Copyright © 2021 CBS Interactive Inc. All rights reserved."
41859054,2011-09-19 21:00:04,Yemen: unfinished business | Editorial,http://www.guardian.co.uk/commentisfree/2011/sep/19/yemen-unfinished-business-editorial,en,False,"politics and government,united states politics and government,international relations",1751,Guardian US,https://www.theguardian.com/us,"Eight months on and Sana'a has just witnessed another mass shooting of anti-government protesters. Yemen's dictator, Ali Abdullah Saleh, is still sheltering in Saudi Arabia, and stalling on the plan mediated by the Saudis and other members of the Gulf Co-operation Council for a political transition. And Oxfam has just issued another report saying widespread hunger and chronic malnutrion have taken hold, with a third of Yemenis – 7.5 million – not having enough to eat. Despite this, the UN-administered Yemen Humanitarian Response Plan has only 55% of the funding it needs this year. Little, in other words, has changed, except maybe the characters who are directing the shooting. If the snipers put in place by Saleh were blamed for most of the 52 deaths on 18 March which became a turning point in the uprising, this time the finger of suspicion points to his son Ahmed, soon to be 40 and thus a presidential candidate himself. Saleh Sr once likened running Yemen to dancing on the heads of snakes. But he was surely being modest about his own role in fomenting the chaos and the killing. He is one of those snakes and his bite continues to be lethal.  Neither the US nor the Saudis are innocent bystanders in all this. For most of the last eight months the US has displayed more energy in hitting al-Qaida affiliates in the south of Yemen with drone strikes than it has in forcing Saleh out. This may not be accidental. The Washington Post reported a significant escalation of drone strikes on Yemen after the US administration concluded that al-Qaida in the Arabian Peninsula (AQAP) posed a more significant threat than al-Qaida in Pakistan. Unlike in other parts of the Arab spring, Yemen's uprising has not affected co-operation between the US and Yemeni forces. That was confirmed in terms by Barack Obama's counterterrorism adviser John Brennan last week, although he went on to say that the violence between loyalist troops and tribal leaders has not involved Yemeni special operations forces trained by the US. In Sana'a this distinction will not be so neatly made, as the Republican Guard, the best-armed and the best-trained of Yemen's armed forces, upholds the writ of Saleh and his son. The state department, on the other hand, issued a statement giving the Yemeni government one week to sign and implement the transition agreement. The US and the Saudis want a co-operative regime in Yemen. The Saudis seek stability on their southern front. Strategic objectives are a long way from meeting the demands of Yemenis who have shed so much blood with such courage. Their champion has yet to emerge, and until it does their uprising is unfinished."
42301312,2011-09-28 21:38:15,Tucson police evacuate federal building over truck,http://feeds.reuters.com/~r/Reuters/domesticNews/~3/4W-squzzrUI/us-tucson-evacuation-idUSTRE78R5YM20110928,en,False,bombs and explosives,1089,Reuters ,http://www.reuters.com/
42350242,2011-09-29 18:58:00,"Fenty: ‘I would never run again, because I would do it exactly the same’",http://feeds.washingtonpost.com/click.phdo?i=6a11efa84a65139b40bef0e97f9b5dfa,en,False,"politics and government,elections,blacks,primaries",2,Washington Post,http://washingtonpost.com,
42420276,2011-09-30 21:55:53,Anwar al-Awlaki's life of extremism,http://www.guardian.co.uk/world/2011/sep/30/anwar-al-awlaki-al-qaida1,en,False,"religion and churches,islam,terrorism,crime and criminals,biographical information",1751,Guardian US,https://www.theguardian.com/us,"April 1971 Born in the southern US state of New Mexico to Yemeni parents. 1978 Returns to Yemen with his family, where he lives for 11 years and studies Islam at Azal Modern school.  1991 Returns to the US to attend Colorado State University. 1994 Graduates with a BS in civil engineering and marries a cousin from Yemen. He also takes a part-time job as imam at the Denver Islamic Society. 1996-2000 Earns a master's in education from San Diego State. Also serves as imam of a mosque in San Diego. His sermons are attended by two future 9/11 hijackers, Khalid al-Mihdhar and Nawaf al-Hazmi. 2001 Moves to a mosque in Virginia, which was attended by Hazmi and a third hijacker, Hani Hanjour. The 9/11 commission found the connections suspicious, speculating that he gave spiritual encouragement to the attackers. 2002 Moves to the UK, giving lectures to Muslim youths, describing the rewards of martyrs in paradise. 2004 Returns to southern province of Shabwa in Yemen and becomes a lecturer at al-Iman University, a Sunni religious school in Sana'a headed by Abdul-Majid al-Zindani, a cleric designated a terrorist by the US and UN for his suspected links with al-Qaida. 2006 Detained by Yemeni authorities, reportedly on charges relating to a plot to kidnap a US military attache. Spends 18 months in prison. November 2009 US army officer Major Nidal Malik Hasan kills 13 people and injures 30 more in a mass shooting at the Fort Hood military base in Texas. The military psychiatrist opened fire with two handguns on fellow soldiers at a training centre. Hasan heard Awlaki preaching at the Dar al-Hiraj mosque in 2001 and also received religious advice from him via email. December 2009 Nigerian national Umar Farouk Abdulmutallab attempts to blow up a Detroit-bound Northwest Airlines jet on Christmas Day with a bomb concealed in his underwear. US officials believe Abdulmutallab met Awlaki in Yemen just weeks before the attempt. Awlaki later admitted that he had ""communications"" with the Nigerian, though he denied any role in the attack. April 2010 The US authorises Awlaki's capture or killing, and he is placed on the CIA target list. The imam says in a videotape that jihad against the US is the duty of every able Muslim. May 2010 Faisal Shazhad attempts to set off a car bomb in Times Square. He tells interrogators he was influenced by Awlaki's rhetoric and inspired by his online messages. May 2010 Roshonara Choudhry, a 21-year-old British Muslim student at King's College London, stabs the Labour MP Stephen Timms, after selecting him from a list of MPs who had voted in favour of invading Iraq. Police believe she had no direct contact with Islamic extremists but was entirely self-radicalised by the online sermons of Awlaki. July 2010 The US names Awlaki as a ""specially designated global terrorist""', and blocks his assets and mademakes it a crime for Americans to do business with him. October 2010 Saudi militant Ibrahim Hassan al-Asiri masterminds an al-Qaida ink-cartridge bomb described as the ""most sophisticated"" device seen for a decade. The bomb, discovered at East Midlands airport, is timed to detonate over the eastern seaboard of the US. Asiri had fled to Yemen in 2008 and was in touch with Awlaki. November 2010 Yemeni authorities place Awlaki on trial in absentia, charging him with inciting violence against foreigners in connection with the killing a French security guard at an oil company compound. Prosecutors claim Awlaki and his cousin, Osman, were in contact with the alleged attacker, Hisham Assem. Awlaki is placed on Yemen's most-wanted list. 30 December 2010 Mohamed Osman Mohamud, a Somali-born US citizen, is arrested by the FBI for an attempted bombing. The American-born Somali planned to detonate the device as thousands attended the lighting of a Christmas tree in the centre of Portland, Oregon. It is thought he was inspired by Awlaki. September 2011 Believed to have been killed in an air strike between the provinces of Marib and Jawf."
42686941,2011-10-06 21:20:00,Steve Jobs: Silicon Valley Mourns the Death of a Founding Father,"http://www.time.com/time/nation/article/0,8599,2096339,00.html?xid=rss-mostpopular",en,False,labor,4419,Time,http://time.com,Return to homepage Your browser is out of date. Please update your browser at http://update.microsoft.com
42697976,2011-10-07 01:21:42,Oct. 7 Readers' letters about the Cupertino shootings,http://www.mercurynews.com/opinion/ci_19057301?source=rss,en,False,"medicine and health,police,crime and criminals,murders and attempted murders",35,San Jose Mercury News,http://www.mercurynews.com/,"Trending: Lessons to be learned from Cupertino rampage Although what Shareef Allman is accused of doing was vicious and horrendous, he did not deserve to die. I wish the police officer would have shot Allman with some kind of pilot gun to injure him instead. I believe this because he deserves to rot in prison his entire life and suffer the same pain and misery that he caused to the victims and their families. I appreciate the hard work from the local police and their effort to find him and keep members of the public safe, but I am having a hard time coping with his death. This news, though, made me appreciate life and how short it can be. Violent people like Allman can take it away in a second, and for that, I will cherish my friends and family more. Randy Nguyen San Jose Police, medical teams, teachers rose to occasion The bravery and dedication of our local law enforcement agencies in protecting residents and local businesses is clearly apparent in the response to the mass shooting in Cupertino. Likewise, medical teams at Valley Medical Center and other area hospitals were on alert to provide additional trauma care, while area teachers sheltered in place, comforting students who arrived at schools despite the announcements of closures. I want to thank those public employees who risked their lives to serve area families during this tragedy. Your employment, benefits and staffing levels should be protected, even during tough economic times, as your work is key to our local safety and security. Catherine Alexander Retired librarian Cupertino Get Morning Report and other email newsletters"
42753771,2011-10-07 23:13:59,Appeals court sends Loughner back to mental hospital,http://rss.cnn.com/~r/rss/cnn_crime/~3/q8iw37JY8dA/index.html,en,False,"medicine and health,decisions and verdicts,murders and attempted murders,mental health and disorders",1095,CNN,http://www.cnn.com/,"By Michael Martinez, CNN  Updated 2313 GMT (0713 HKT) October 7, 2011"
42775710,2011-10-08 16:35:44,Court orders Loughner back to Mo. hospital,http://www.upi.com/Top_News/US/2011/10/08/Court-orders-Loughner-back-to-Mo-hospital/UPI-55591318091744/,en,False,"medicine and health,murders and attempted murders",1706,UPI,http://www.upi.com/,"TUCSON, Oct. 8 (UPI) --  A federal appeals court ordered Tucson mass shooting suspect Jared Loughner back to a Missouri prison hospital while appealing his forced psychiatric treatment. Loughner had requested he remain in Tucson, where he was arrested in January for a killing spree aimed at U.S. Rep. Gabrielle Giffords, D-Ariz., CNN reported. He was sent to the Federal Medical Center in Springfield, Mo., after being found unfit to stand trial.
Advertisement Six people, including a 9-year-old girl and a federal judge, were killed when Loughner opened fire outside a Tucson supermarket. Thirteen were wounded, including Giffords, who was shot in the head and has been undergoing rehabilitation. ""Loughner has been determined to require psychiatric treatment and will be involuntarily medicated for the immediate future whether or not he is transported to the Missouri facility,"" the 9th U.S. Circuit Court of Appeals ruled Friday. ""As he therefore has not demonstrated any irreparable harm that is probable if the stay is not granted, we deny the emergency motion."""
42793135,2011-10-09 07:36:39,Smuggled U.S. ammo feeds drug wars,http://rssfeeds.usatoday.com/~r/usatoday-NewsTopStories/~3/ym6DoMtYIJ4/1,en,False,"drug abuse and traffic,drug traffic",4,USA Today,http://www.usatoday.com
43223207,2011-10-06 18:37:00,Taking the kids to the largest and newest Legoland in the world,"http://feeds.chicagotribune.com/~r/chicagotribune/travel/~3/FO0yJNIsJco/sns-family-travel-to-legoland-20111006,0,7453932.story",en,False,"no index terms from nytimes,budgets and budgeting",9,Chicago Tribune,http://www.chicagotribune.com/,"Perhaps we can help you find what you wanted when you hit this error page? Try our site map for a list of all online sections or check out our columnists page. We also have search tools for finding a particular stories and topics pages covering many major issues and people. If you are looking for a particular suburban publication or story, the best place to start is our suburbs page. Finally, you may want to take a look at our archives, which date back to 1849. If none of these suggestions work, please feel free to read through our FAQ or send us a question or comment."
