stories_id,publish_date,title,url,language,ap_syndicated,themes,media_id,media_name,media_url,text
31102062,2011-02-07 16:41:32,Gabrielle Giffords shooting: Urgent response amid chaos,http://rssfeeds.usatoday.com/~r/usatoday-NewsTopStories/~3/jNSUred6Hq0/2011-02-07-giffords-shooting-chain-of-events-chapter-3_N.htm,en,False,,4,USA Today,http://www.usatoday.com,"Updated  | Stuart Rodeffer climbed out of his pickup at Mountain View High School in Marana and checked in with the crew of the fire engine that had rolled out for the call. Nothing too much to worry about; another situation under control. By James Palka, AP Bystanders embrace at the scene where Rep. Gabrielle Giffords and others were shot outside a Safeway grocery store in Tucson on Jan. 8. By James Palka, AP Bystanders embrace at the scene where Rep. Gabrielle Giffords and others were shot outside a Safeway grocery store in Tucson on Jan. 8. That was Saturday so far for Rodeffer, a battalion chief for the Northwest Fire/Rescue District in Tucson: everything under control. He had clocked in at 7 that morning, reveling in the small weekend luxury of wearing a T-shirt to work. He would work a 24-hour shift, then catch four days off. Rodeffer celebrated his 46th birthday on Friday with a punishing kettlebell workout and dinner at Red Lobster with his parents and Maggie, his wife of 18 years. Saturday, Jan. 8, was slow so far. A patient with chest pains; a minor bike accident, the cyclist skinned up and bruised. Rodeffer dispatched himself to both calls and handled them. Under control. At 10:14, a call came across the radio: first-alarm medical. Severe emergency. An address about 7 miles to the south and east. Ina and Oracle roads. Rodeffer jumped in his truck and headed there. As Rodeffer sped through the sparse Saturday-morning traffic, radio chatter turned frantic. More units dispatched. Injuries. Multiple injuries. He called Lane Spalla, another battalion chief. ""Lane, this is sounding like a deal,"" Rodeffer said. ""What are you thinking?"" Spalla was already there — a shopping center with a Safeway. Rodeffer pulled up, but everyone was being held back. Police were still securing the scene. Finally, medical responders were cleared. Rodeffer parked his truck on the west edge of the lot and walked quickly toward the store. A banner sharpened into focus: Gabrielle Giffords, in red letters, United States Congress in blue. The banner didn't register in Rodeffer's mind. Instead, he saw only the scene in front of it. In his years as a Marine, in a decade of emergency service, he had never seen this. Bystanders were swarming the firetrucks, tugging desperately at firefighters, reaching for medical equipment. ""People are dying here!"" someone cried. ""We need your help!"" Two miles away, the alarms sounded at Northwest Fire/Rescue District Station 30. The dispatcher's voice was measured, but the words conveyed the urgency: engine. Rescue. Battalion. Firefighter and paramedic Tony Compagno reached for his fire gear and then heard the words: 10 people shot. ""At the fire?"" Compagno asked his captain. ""There's no fire,"" the captain said. The radio buzzed. The units flew. Compagno and his crew were among the first to arrive. They waited for police to let them through and found chaos. Bodies. So much blood. Compagno was assigned triage: assess and count the victims and figure out who needed help first. No time to write it down. He had to keep it in his head. I gotta get in there, he thought, gotta make the count. He saw a man lying face down in a pool of blood and fixed on the image. His mind froze for an instant. So much blood. Come on! he told himself. Come on! He heard yelling, and one voice broke through. ""Congresswoman Giffords has been shot! Over here!"" Compagno ran to her. She was alive. He stood in the cramped walkway in front of the store and scanned the ground. He did the numbers. Four dead for sure. Seven people needed immediate attention. A little girl on the ground. He heard another voice, from someone else in the crew. ""How many helicopters?"" ""Launch all of them,"" Compagno said. Then another voice. Engine 33 was on the scene. ""Who? Who's next?"" Who's next? he thought. ""Her,"" Compagno said, pointing to the little girl, bloodied, unconscious. ""Her."" He knew her injuries were significant. Terrible. But the dad in him. .. he didn't want her to be dead. The second crew was up. Compagno pointed them toward the woman in the red coat. Colt Jackson bent down and took her hand. ""Hi, I'm Paramedic Jackson,"" he said. ""Can you hear me?"" She squeezed his hand. He went through the basics, the ABCs: check her airway, breathing and circulation. He put her on oxygen. He turned to a young man at the patient's side, dark hair, glasses. The man hadn't budged, even with all the blood. Hold her like this, Jackson told him. It will protect her back. ""This is Congresswoman Giffords,"" the young man said. ""I'm staying."" Daniel Hernandez had been an intern for her office for exactly five days when he arrived for the meet-and-greet at the Safeway that morning. When the shooting started, other staffers went down, hit. One of them, Ron Barber, turned to Hernandez. ""Make sure you stay with Gabby,"" Barber said. ""Make sure you help Gabby."" Hernandez had pressed his bare hand against her head to stop the bleeding until medics arrived. Now, he walked alongside the stretcher, holding her hand. The ambulance doors opened. He climbed inside. As the ambulances rolled out, headed south toward University Medical Center, Compagno continued directing the help at the scene. More paramedics flooded in as helicopters droned. But that wasn't what Compagno noticed. All around the victims were bystanders, family, friends — just regular people, comforting them, giving them CPR. One man used his belt as a tourniquet. They're not alone, he thought. None of them is alone. James Palka left his house a few minutes before 10:30. He had packed two cameras he used for event photography, the lenses set up for the meet-and-greet. He left the house where he ran his freelance business and turned on to Ina Road, heading east. He was really just going out of personal interest, to photograph U.S. Rep. Gabrielle Giffords at her ""Congress on Your Corner"" event. About a mile away from the Safeway, a speeding paramedic truck passed. Then another. A firetruck. He wondered if there had been an accident. As he neared the shopping center, traffic slowed and sirens wailed again. His stomach seized as the thought hit him. What if someone had tried to kill the congresswoman? He reached Oracle Road and saw firetrucks and emergency vehicles and one. .. two. .. three. .. four ambulances. Palka eased through the intersection. Most of the entrances had been blocked by wooden sawhorses and police tape, but he spotted a side driveway still open. He pulled in and parked. He got out of his car and somehow remembered to bring his camera. He stood for a moment. A scruffy-looking man stood near him behind the police line. ""What happened?"" Palka asked. ""Someone shot the congresswoman,"" the man said. Palka felt weak. Why her? he asked himself. She's one of the good ones. For several minutes, Palka watched as a bystander, as a person. He took pictures of parties, fundraisers. His work as a photographer hadn't prepared him for this. Then he remembered his camera. No one else was taking pictures, he realized, not even with a cellphone camera. He was carrying his 70-300mm telephoto and could see the scene from the police line. He raised the camera and started taking pictures: Emergency workers treating the wounded, lifting people onto gurneys. Medical helicopters landing in the parking lot. Police officers talking to witnesses. Bloodied men and women comforting one another. He heard voices rise, then saw paramedics pushing a gurney toward an ambulance. A young man stayed alongside, his hand on hers. The patient was clearly hurt badly, her head bloodied. It was her. It was Giffords. Palka snapped a series of photos as she was put in the ambulance. It was 10:41 a.m. A half-hour had passed since the first shots were fired. Anna Ballis crouched on the sidewalk in front of the Safeway, applying pressure to the upper leg of Giffords' district director. Ron Barber had been a total stranger only moments before. She propped his head on a jacket to make him more comfortable. Ballis had stopped at the grocery store to buy beef broth for a roast she intended to put in a slow cooker. She saw Giffords' event and thought about stopping, but the line looked too long. Then a man with a white beard stepped out and encouraged her to come by after she'd finished. Giffords would still be here, he said. Moments later, the shooting started. Ballis reacted instinctively, ducking behind a pillar, then under a table. When the shooting stopped, she regained her bearings. Then she saw the man with the white beard, bleeding badly. She ran to his side and put pressure on his wound. Barber seemed more concerned about everyone else than himself, and Ballis had to reassure him that Giffords and the others were being cared for. He squeezed her hand. ""Thank you,"" he said. Steve Rayle sat on the gunman until sheriff's deputies arrived. Then his medical training took over. A hospice doctor who had worked in emergency rooms, Rayle surveyed the scene. He moved from victim to victim, offering advice, encouragement, comfort. He administered CPR to one man. But he couldn't provide what the victims needed most. Blood. They were losing too much blood. Someone brought clean rags and aprons from Safeway's butcher shop. Rayle and others grabbed them, pressing down on the bleeding wounds. Bill Badger could feel the stinging in his head, where a bullet had grazed him. Faith Salzgeber had found something from inside Walgreens to sop up the blood. As paramedics treated his injury, Badger still held his mobile phone in his left hand. With his left thumb, he dialed home. His wife, Sallie, answered. ""I've been hit,"" he said, his own words difficult to believe. ""But I'm OK."" Across the parking lot, in a Pima County sheriff's vehicle, a young man sat in handcuffs. He wore a dark hooded sweatshirt. His face was bleeding and swollen. Jared Loughner said almost nothing. Roger Salzgeber began to tremble as the rush of adrenaline subsided and the chill morning air wrapped around him. He shook as he watched the emergency workers, watched his wife helping. As paramedics ushered the uninjured away from the shooting scene, Roger and Faith began to settle in with the uneasy reality of what had happened. The rage he had felt as he pinned the gunman began to give way to the truth. Everyone around me, he thought, is either injured or dead. The first ambulances were allowed on the scene at 10:19. More arrived over the next half-hour. Rodeffer, the battalion chief, pushed crews to move quickly. ""Let's get 'em in ambulances and get 'em on the road,"" he said. Thirteen people went to hospitals. One man drove himself. Five people died at the scene. Several others were in grave condition. As the ambulances sped away and helicopters flew some of the wounded to UMC, the news began to break upon a stunned city and then a horrified nation. Another mass shooting. Except this time, the shooting was at a congresswoman's event. Some of the earliest reports surfaced on National Public Radio. The Internet blasted bulletins. Twitter feeds caught fire. A brief mention on CNN grew into non-stop coverage. The facts were scarce at first. Even as victims were rushed to hospitals, news crews could barely sketch out what had happened. How many shot? How many killed? Then, soon, came the unthinkable. A dispatch presented with a question mark at first. A report said it was true. Soon, other reports cited the first report. The news caught up to anxious friends and relatives seeking word from hospitals. It caught up to worried onlookers. It caught up to a private jet streaking from Houston toward Tucson, carrying a Navy pilot-turned-astronaut, racing to be with his congresswoman wife. The word flashed across the Internet, then the airwaves. Gabrielle Giffords was dead. Chapter 4 coming Tuesday.  Posted  | Updated Advertisement"
31122744,2011-02-07 17:53:06,Hearing for Youngstown suspects postponed a day as investigation of shooting continues,http://blog.cleveland.com/metro/2011/02/hearing_for_youngstown_suspect.html,en,True,,1641,cleveland.com,http://www.cleveland.com/,"YOUNGSTOWN, Ohio (AP) -- A prosecutor says two suspects in a deadly shooting at an Ohio fraternity house could face additional charges. Youngstown City Prosecutor Jay Macejko  says a court appearance scheduled for the two men Monday morning was delayed until Tuesday. He says police requested the delay because of possible new developments that could lead to more charges. Macejko has declined to say what the new charges could be. A college student was shot to death and 11 people were wounded in the shooting early Sunday. Nineteen-year-old Braylon L. Rogers and 22-year-old Columbus E. Jones Jr. were arrested Sunday on charges of aggravated murder and shooting into a house and 11 counts of felonious assault. Police accuse the men of spraying bullets into partygoers at the Omega Psi Phi frat house near the Youngstown State University campus. At a press conference Sunday afternoon, Youngstown 1st Ward 
Councilwoman Annie Gillam said it's hard to make sense of the tragedy, 
which occurred in her ward of the city.  ""It's a sad day. We need to find a way to make our young people value
 life -- their own and other people's lives and how to deal with 
conflict,"" she said. .' ""People just started pushing each other,"" said YSU freshman DeShaun McDonald.  As the fight escalated, McDonald and a friend decided it was time to 
leave. Before they could exit, the shooter was pushed out of the house, 
only to immediately charge back in. That's when the gunshots began. ""As soon as we begin to move, all I hear, it's just like pow, pow, 
pow, pow, pow. Like, at least 12 or more times,"" McDonald said. * ""I want to express my deepest sympathies to the family of the student who died ..."" ""I have offered to them the use of any and all state resources they 
might require,"" Kasich said. ""I will continue to monitor the situation 
and provide any support necessary to help those impacted by this tragic 
event."" A detective  also said police still are trying to confirm if the shooting was 
related to a fight that took place several hours earlier at the Love 
Lounge bar on West Federal Street. Jaleesa Moore just wanted to celebrate her 20th birthday by going out 
with friends. Now doctors tell her she won't be able to hold her 9-month
old daughter for two months. Moore was one of 12 people shot at the party about 3:30 a.m. Sunday at a house near the YSU campus. Victim Jamail Johnson's Facebook page lists him as a 2005 Liberty 
graduate, Youngstown State University senior and part-time manager at a 
Footlocker store. The 25-year-old was shot in the head and legs when 
gunfire erupted during a party at 3 a.m. at 55 Indiana St. ""There has been an ongoing decline in violent crime in Youngstown, 
Ohio.  But when you have an incident like this, there's no excuse. 
There's nothing you can do to put a pretty picture on it and 
unfortunately it does overshadow the progress we have made,"" Mayor Jay Williams says. Radio personality Lucky Penny says he knew the victim, 25-year-old Jamail Johnson, from seeing him in passing at different events. ""He
 was a good guy. He didn't live that lifestyle; real great guy coming 
from a very good family. Had a lot of future aspirations he wanted to 
do, and it's been cut short,"" he said. * s Note to readers: if you purchase something through one of our affiliate links we may earn a commission. Registration on or use of this site constitutes acceptance of our   User Agreement,  Privacy Policy and Cookie Statement,  and Your California Privacy Rights  (User Agreement updated 1/1/21. Privacy Policy and Cookie Statement updated 5/1/2021). Cookie Settings © 2021 Advance Local Media LLC. All rights reserved (About Us).  The material on this site may not be reproduced, distributed, transmitted, cached or otherwise used, except with the prior written permission of Advance Local. Community Rules  apply to all content you upload or otherwise submit to this site. Ad Choices"
31166646,2011-02-08 13:41:50,Wounds remain fresh 1 month after Tucson shooting,http://www.sacbee.com/2011/02/08/3385355/wounds-still-fresh-1-month-after.html#mi_rss=Wire%20National%20News,en,True,,26,Sac Bee,http://www.sacbee.com/
30083030,2011-01-18 04:17:11,Ariz. legislators seek more gun rights,http://feeds.boston.com/click.phdo?i=b8dbdf9ef614f223043e201137eb5d47,en,True,,15,The Boston Globe,https://www.bostonglobe.com/,Feed Address: HTTP Error (Code) and Message: (404) Feed not found error: FeedBurner cannot locate this feed URI.
30070531,2011-01-17 22:12:00,Dad: Arizona girl's corneas saved vision of 2 kids,http://www.miamiherald.com/2011/01/17/2020454/dad-arizona-girls-corneas-saved.html,en,True,,28,Miami Herald,http://www.miamiherald.com/
30064575,2011-01-17 18:21:00,"'Miraculous' Is Still Word To Use About Giffords' Condition, Doctor Says",http://www.npr.org/blogs/thetwo-way/2011/01/17/132999079/miraculous-is-still-word-to-use-about-giffords-condition-doctor-says?ft=1&f=1003,en,False,,1096,NPR,http://www.npr.org/,"NPR’s sites use cookies, similar tracking and storage technologies, and information about the device you use to access our sites (together, “cookies”) to enhance your viewing, listening and user experience, personalize content, personalize messages from NPR’s sponsors, provide social media features, and analyze NPR’s traffic. This information is shared with social media, sponsorship, analytics, and other vendors or service providers. 
            See details. You may click on “Your Choices” below to learn about and use cookie management tools to limit use of cookies when you visit NPR’s sites. You can adjust your cookie choices in those tools at any time. If you click “Agree and Continue” below, you acknowledge that your cookie choices in those tools will be respected and that you otherwise agree to the use of cookies on NPR’s sites.  NPR’s Terms of Use and Privacy Policy."
30061815,2011-01-17 14:52:00,"After tragedy, Ariz. lawmakers eye more gun rights",http://www.kansascity.com/2011/01/17/2588880/after-tragedy-ariz-lawmakers-eye.html#storylink=rss,en,True,,30,Kansas City Star,http://www.kansascity.com/
30061803,2011-01-17 22:07:00,Dad: Arizona girl's corneas saved vision of 2 kids,http://www.kansascity.com/2011/01/17/2590136/dad-arizona-girls-corneas-saved.html#storylink=rss,en,True,,30,Kansas City Star,http://www.kansascity.com/
30058174,2011-01-17 20:18:12,Tucson shootings form backdrop to King Day celebration,http://feeds.reuters.com/~r/reuters/topNews/~3/0F8-HdHcxek/idUSTRE70G5K720110117,en,False,,1089,Reuters ,http://www.reuters.com/
30034855,2011-01-17 09:02:00,Rep. Gabrielle Giffords condition improves,http://www.kansascity.com/2011/01/17/2588441/rep-gabrielle-giffords-condition.html#storylink=rss,en,True,,30,Kansas City Star,http://www.kansascity.com/
30021596,2011-01-16 18:30:13,Video: ABC airs alleged death threat from Tucson town hall,http://hotair.com/archives/2011/01/16/video-abc-airs-alleged-death-threat-from-tucson-town-hall/,en,False,,117,Hot Air  ,http://hotair.com,"Earlier on Twitter, some accused ABC of scrubbing the outburst from Tucson shooting victim Eric Fuller when Tea Party organizer Trent Humphries spoke at This Week’s townhall event. Not so, reports Mediaite, but it’s obvious why some people thought so; the interjection of Fuller allegedly saying “You’re dead” was hard to hear during Humphries’ miked-up contribution. Tommy Christopher boosted the audio and bold the preceding text to mark it, and even then it took two passes for me to hear it: TRENT HUMPHRIES: It’s not just gun laws that are standing in the way of this happening. There are all kinds of laws that Congress needs to look at and — and I think there is a time for this debate. But for what we saw and felt right now, I’m not sure that applause and things going on are appropriate right now until we’ve had actually, maybe had the funerals finished for the people that have –that were (sic) suffered and died. My neighbor is one of those people. And — and I loved that man. And — and I want to see — I want to see some introspection maybe from the people before the national debate happens. You know, and those — and — and it’s very well to have those things. But something’s going to have to happen with — with everybody. And — and I just — I mean, it’s — it’s something that where as a country, we talk about political discourse and what’s appropriate and what’s not. I think that — that applies to everybody including the media who’s — who’s — you know, and not in this — this — this has been a very, very cathartic thing for everybody. Immediately after the shooting to see people jump to political angles. I just don’t want to see that right now and I’m a very political person. So I — I would ask that maybe we — we have that discussion and it’s a larger discussion and that — and that we have that just a little bit later. NBC reports that Fuller has been held for involuntary psychiatric screening, as well as on charges of threats, intimidation, and disorderly conduct: A Tucson mass shooting victim was taken into custody Saturday after yelling “you’re dead” at a Tea Party spokesman during the taping of an ABC-TV town hall event hosted by Christianne Amanpour. The Pima County Sheriff’s Office said J. Eric Fuller, 63, was involuntarily committed to an undisclosed medical facility, NBC News reported. The Associated Press said he was undergoing a psychiatric evaluation. He faces charges of threats and intimidation and disorderly conduct, according to Tucson TV station KGUN. … Fuller was in the front row and apparently became upset when Humphries suggested that any conversations about gun control should be delayed until all the dead were buried, KGUN reported. Fuller took a picture of Humphries and shouted, “You’re dead.” Some reports, NBC notes, had Fuller making other remarks, as well as bystanders saying that they became increasingly concerned over his behavior. This is an ironic turn after a week in which conservatives were accused of causing the shooting through supposedly “extreme rhetoric,” but people should resist the temptation to turn Fuller into some sort of poster boy of the Left in response.  He was one of the victims of the January 8th attack, and that would be enough to make anyone angry enough to act a little irrationally in the immediate aftermath.  Hopefully the psychiatric screening will prompt Fuller to seek counseling, or his family to insist on it.  If this week taught us anything, it’s the danger of knee-jerk demonization for political pointscoring.  We have been praying for all of the victims, and we’ll continue to do so for healing to those wounded, including Fuller. Update: Just to clarify, Tommy boosted that part of the audio so that people could hear it more clearly in this clip; he heard it himself clearly when it first happened. I misunderstood what he wrote in his article. Copyright ©2021 HotAir.com/Salem Media. All Rights Reserved."
30014823,2011-01-16 22:05:20,Military Recruit Loophole in Gun Laws,http://www.foxnews.com/politics/2011/01/16/schumer-require-military-report-applicants-drug-use-prevent-gun-purchases/,en,False,,1092,Fox News,http://www.foxnews.com/,"This material may not be published, broadcast, rewritten,
      or redistributed. ©2021 FOX News Network, LLC. All rights reserved.
