stories_id,publish_date,title,url,language,ap_syndicated,themes,media_id,media_name,media_url,text
			| Report abuse This man is my hero! Posted by: nellie3ster | January  9, 2011  1:31 PM 
			| Report abuse This guy's my new hero - but of course, the people he's talking about won't see themselves in his comments because they are so totally self-absorbed (and their listeners have no ability to discriminate fact from BS). Posted by: lizlaurel | January  9, 2011  1:26 PM 
			| Report abuse This tragedy has done nothing to diminish the hateful wrath of comments. Just read all the mouth frothing rabidity that has been posted here. Some of these goons sound like they're ready to kill someone. Civility has to begin in the blogosphere. Go post your ignorant hatred at evil.com Posted by: TeddyRoosevelt | January  9, 2011  1:26 PM 
			| Report abuse Finally someone with the courage and insight to expose the right wing cesspool especially in AZ. Posted by: vztownes | January  9, 2011  1:25 PM 
			| Report abuse ""The crossfire is intense, so penetrate through enemy territory by bombing through the press, and use your strong weapons -- your Big Guns -- to drive to the hole. Shoot with accuracy; aim high and remember it takes blood, sweat and tears to win,"" -- Sarah Palin Posted by: insider9909 | January  9, 2011  1:17 PM 
			| Report abuse ""The crossfire is intense, so penetrate through enemy territory by bombing through the press, and use your strong weapons -- your Big Guns -- to drive to the hole. Shoot with accuracy; aim high and remember it takes blood, sweat and tears to win,"" -- Sarah Palin Posted by: insider9909 | January  9, 2011  1:17 PM 
			| Report abuse What ""public"" is the  author referring too? All the public or the ""wapo public"". When something like this happens the left politburo with out any evidence starts placing blame on the right and those that subscribe to the tea party. When the left says something it is correct and sacrosanct. When the right says something it is hate speech and anti social. The mad hatter lives!  I think the people on the left have been inhaling too many  fumes from broken new ""green"" mercury laden light bulbs..... Posted by: ezwriter | January  9, 2011  1:16 PM 
			| Report abuse Yeah, let's blame Beck and O'Reilly as Oberman (MSNBC) and Roland Martin (CNN) did yesterday...pfft, this guy is a nut job and from his background is probably a left winger...nice try! Posted by: mjandrews8 | January  9, 2011  1:14 PM 
			| Report abuse What ""public"" is the  author referring too? All the public or the ""wapo public"". When something like this happens the left politburo with out any evidence starts placing blame on the right and those that subscribe to the tea party. When the left says something it is correct and sacrosanct. When the right says something it is hate speech and anti social. The mad hatter lives!  I think the people on the left have been inhaling too many  fumes from broken new ""green"" mercury laden light bulbs..... Posted by: ezwriter | January  9, 2011  1:13 PM 
			| Report abuse Obama inciting violence, WaPo? http://hillbuzz.files.wordpress.com/2011/01/screen-shot-2011-01-08-at-9-37-39-pm1.png Posted by: grunk | January  9, 2011  1:11 PM 
			| Report abuse I hope that the good citizens of AZ remember that Dupnik chose politics over law enforcement and evidence. Posted by: bethg1841 | January  9, 2011  1:10 PM 
			| Report abuse Show me one concrete piece of evidence that:
1. This moron was a 'Follower' of Sarah Palin. 2. That he was a member of the 'Tea Party'. 3. That he ever voted or voted Republican. 4. That he ever contacted Sarah Palin. 5. Proof that he DIDN'T Read and avow Communism. 6. That he wasn't a LIBERAL as described by a close friend to the NYTs. 7. Show me concrete proof ANYONE connected with the Tea party of Republicans or Sarah Palin vandalized her offices!! I'm waiting . . . waiting. . . . :crickets: Oh, I forgot -- FACTS don't matter to the Despicable LEFT!! Posted by: Armymom10 | January 9, 2011 why don't you read the article instead of spewing your nastiness. His statement was the vitriol being spewed could effect a mentally unstable person. That is the fact in his statement. Maybe a better thing would be to shut off all the message boards and comments sections where people get echo chamber support for their violent or vile comments Posted by: chet_brewer | January  9, 2011  1:08 PM 
			| Report abuse Maybe this happened because Beck and Limbaugh go around saying they want to kill people; Posted by: newsboy3 | January 9, 2011 12:49 PM | Report abuse =========================================== Why does the left-wing feel that they have the right to make ignorant statements like this?  There is absolutely no truth to this statement. Posted by: bethg1841 | January  9, 2011  1:07 PM 
			| Report abuse Dupnik, 74, a Democrat who has served as Pima County sheriff since 1980, is known for his colorful and often bluntly partisan commentary. Last year, he refused to enforce Arizona's aggressive new law targeting illegal immigrants, calling it ""stupid"" and ""racist."" He coined the phrase ""political fornickaboobery,"" to describe the motives he felt were behind the crackdown. ====== Looks like he found this a wonderful opportunity to express his views further. All we asked for is sane immigration laws and enforcement. Posted by: hipshot | January  9, 2011  1:07 PM 
			| Report abuse Maybe this happened because Beck and Limbaugh go around saying they want to kill people; Posted by: newsboy3 | January 9, 2011 12:49 PM | Report abuse =========================================== Why does the left-wing feel that they have the right to make ignorant statements like this?  There is absolutely no truth to this statement. Posted by: bethg1841 | January  9, 2011  1:06 PM 
			| Report abuse Maybe this happened because Beck and Limbaugh go around saying they want to kill people; Posted by: newsboy3 | January 9, 2011 12:49 PM | Report abuse =========================================== Why does the left-wing feel that they have the right to make ignorant statements like this?  There is absolutely no truth to this statement. Posted by: bethg1841 | January  9, 2011  1:06 PM 
			| Report abuse Maybe this happened because Beck and Limbaugh go around saying they want to kill people; Posted by: newsboy3 | January 9, 2011 12:49 PM | Report abuse =========================================== Why does the left-wing feel that they have the right to make ignorant statements like this?  There is absolutely no truth to this statement. Posted by: bethg1841 | January  9, 2011  1:06 PM 
			| Report abuse """"I hope to GOD that Sara Palin is reading this."" Posted by: theFieldMarshall"""" ""Don't think reading is in her skill set, dude. Neither are empathy for the suffering of others or compassion."" Posted by: nicekid But dude! Sarah Palin recently spent several hours in Haiti. What more does she have to do to convince you that she is a compassionate, humanitarian giant? In actually Palin actually had to touch a poor, black person's hand! Posted by: jjedif 
===========================================
Going to Haiti for a photo op is not same as parting with some of the over 10 million she made last year. Her let them eat cake mentality does not resonate with too many except Tea Party loyalists. Posted by: jameschirico | January  9, 2011  1:05 PM 
			| Report abuse Maybe this happened because Beck and Limbaugh go around saying they want to kill people; Posted by: newsboy3 | January 9, 2011 12:49 PM | Report abuse =========================================== Why does the left-wing feel that they have the right to make ignorant statements like this?  There is absolutely no truth to this statement. Posted by: bethg1841 | January  9, 2011  1:05 PM 
			| Report abuse Mental instability + guns (lot of guns) + hateful rhetoric = ? I was taught never to light a match near gasoline. Posted by: lorgig | January  9, 2011  1:05 PM 
			| Report abuse Maybe this happened because Beck and Limbaugh go around saying they want to kill people; Posted by: newsboy3 | January 9, 2011 12:49 PM | Report abuse =========================================== Why does the left-wing feel that they have the right to make ignorant statements like this?  There is absolutely no truth to this statement. Posted by: bethg1841 | January  9, 2011  1:05 PM 
			| Report abuse Mental instability + guns (lot of guns) + hateful rhetoric = ? I was taught never to light a match near gasoline. Posted by: lorgig | January  9, 2011  1:05 PM 
			| Report abuse Our country's very dignity is at stake? There appears to be more chaos in the News than perhaps, at the shooting sight. Comments made here, will not help to bring calm across our country. We all express our aversion to crime,where ever committed, that image is wiped out in our day to day living.Our expressions that come out of dissent are as extreme as our expressions of Happiness. It is not the gun only that is killing, it is our attitudes. In an instant we turn from good to bad, our minds are just balancing on the thin side of the coin or wedge.The same expressions are seen on the TV that we watch every day.Our society is so advanced, we have forgotten the acts of civility, each day is like a Video that is fast-forwarded-this is no way that we should act like this and at the same time preach.God help this countryit, is not war, it is just act of chaos in our mind. Posted by: jayrkay | January  9, 2011  1:05 PM 
			| Report abuse The Right Wing Media lead by Fox News along with Sarah Palin and Rush Limbaugh should also be charged as Co-Conspirators in this tragedy. Their constant lies and distortions have fouled the airways since Obama won the Election for Prsident. They could not get over that Obama was elected and have done so much to divide this country. And yes, some of the rethoric coming from MSNBC hasn't helped either, but it also hasn't been on the grand scale as Fox News has. The FCC needs to step in and start regulating the cable news. And people like Sarah Palin, Rush Limbaugh and others who believe that lies is reporting should be banned from the airways all together. There also should be a change in the rules for all US Congressmen and woman and US Senators that when you take the floor and outright lie just to please your base you should be censured and or impeached. Congressional people are immuned to prosecution if they outright lie and this should be changed. Posted by: sumo1 | January  9, 2011  1:04 PM 
			| Report abuse The Right Wing Media lead by Fox News along with Sarah Palin and Rush Limbaugh should also be charged as Co-Conspirators in this tragedy. Their constant lies and distortions have fouled the airways since Obama won the Election for Prsident. They could not get over that Obama was elected and have done so much to divide this country. And yes, some of the rethoric coming from MSNBC hasn't helped either, but it also hasn't been on the grand scale as Fox News has. The FCC needs to step in and start regulating the cable news. And people like Sarah Palin, Rush Limbaugh and others who believe that lies is reporting should be banned from the airways all together. There also should be a change in the rules for all US Congressmen and woman and US Senators that when you take the floor and outright lie just to please your base you should be censured and or impeached. Congressional people are immuned to prosecution if they outright lie and this should be changed. Posted by: sumo1 | January  9, 2011  1:03 PM 
			| Report abuse The Right Wing Media lead by Fox News along with Sarah Palin and Rush Limbaugh should also be charged as Co-Conspirators in this tragedy. Their constant lies and distortions have fouled the airways since Obama won the Election for Prsident. They could not get over that Obama was elected and have done so much to divide this country. And yes, some of the rethoric coming from MSNBC hasn't helped either, but it also hasn't been on the grand scale as Fox News has. The FCC needs to step in and start regulating the cable news. And people like Sarah Palin, Rush Limbaugh and others who believe that lies is reporting should be banned from the airways all together. There also should be a change in the rules for all US Congressmen and woman and US Senators that when you take the floor and outright lie just to please your base you should be censured and or impeached. Congressional people are immuned to prosecution if they outright lie and this should be changed. Posted by: sumo1 | January  9, 2011  1:03 PM 
			| Report abuse Tell me: which reckless and irresponsible politician said, ""If they bring a knife to the fight, we'll bring a gun""? That guy is the one to blame. Posted by: diesel_skins_ | January  9, 2011  1:02 PM 
			| Report abuse Maybe the Daily Kos inspired this kid: http://hillbuzz.org/2011/01/08/my-congresswoman-voted-against-nancy-pelosi-and-is-now-dead-to-me-eerie-daily-kos-hit-piece-on-gabrielle-giffords-just-two-days-before-assassination-attempt-on-her/ Somebody ask the Sheriff, since he has his finger on the pulse of everything. Posted by: grunk | January  9, 2011  1:01 PM 
			| Report abuse If it bleeds, it leads . . . Look at the press coverage of this tragedy - the big eye of American corporate media is focused on Tucson . . . almost to the exclusion of everything else occuring in the world. Team Coverage 'cause we're in yer face 24/7/365 . . . . . . oh yeah, by the way . . . we're in an ""event"" now so the advertising rates have just increased by 15% - ya should have had a contract.  Maybe we can get ya set up for the next one . . . but ya gotta act quick! The yammering gasbags on cable TV and talk radio will hang their heads sheepishly for about a week and then it'll be back to normal with them spewing their wretched refuse. Why can't we have a ""Turn Off The Hate"" campaign where the OFF button is used on the remote for Limbaugh, Olbermann and the rest of the gang of prostitutes? Huh?  Hun? HUH? Can you hear me now? Posted by: palmtree2001 | January  9, 2011  1:01 PM 
			| Report abuse I think the people (including this sheriff) who blame some talking head for this violence are just projecting. Consumed by their own twisted hateful thoughts, they believe others could be likewise inspired. What sort of nutcase really thinks the drivel from Beck, Palin, Maddow, or Olberman is hateful? You people are crazy. Posted by: dacyzyn | January  9, 2011  1:01 PM 
			| Report abuse No one is saying Sarah Palin or other conservatives are legally responsible for the actions of this seriously deluded individual.  He is responsible for his own decisions and should reap the consequences.  But words have consequences too, and the language so frequently utilized by Palin, Angle, and others - comments about ""eliminating"" the opposition, ""reloading,"" and ""resorting to our second amendment  rights"" in order to deal with folks on the other side of the political aisle, not to mention the visual metaphors of using crosshairs to target individuals in election campaigns - only helps to normalize the actions described by that language.  Once people get used to hearing it, its not a far leap for someone who is mentally vulnerable to act on it, thinking that it is, in fact, normal or expected behavior. So no, its not Palin's fault.  But she bears responsibility for setting such a nasty, violent tone, as do many others on the right. Posted by: glh032003 | January  9, 2011  1:00 PM 
			| Report abuse No one is saying Sarah Palin or other conservatives are legally responsible for the actions of this seriously deluded individual.  He is responsible for his own decisions and should reap the consequences.  But words have consequences too, and the language so frequently utilized by Palin, Angle, and others - comments about ""eliminating"" the opposition, ""reloading,"" and ""resorting to our second amendment  rights"" in order to deal with folks on the other side of the political aisle, not to mention the visual metaphors of using crosshairs to target individuals in election campaigns - only helps to normalize the actions described by that language.  Once people get used to hearing it, its not a far leap for someone who is mentally vulnerable to act on it, thinking that it is, in fact, normal or expected behavior. So no, its not Palin's fault.  But she bears responsibility for setting such a nasty, violent tone, as do many others on the right. Posted by: glh032003 | January  9, 2011 12:59 PM 
			| Report abuse The hatemongers and bigots on the right, and their conduit for hate, FOX and Hate Radio, are already falsely accusing the killer as a ""leftist.""  So a ""leftist"" who hates the government, wants the gold standard (like Beck), shoots democrats, one of whom voted in favor of the ""leftist"" health care bill.  No!  This nut took his cue from those on the right yelling about ""second amendment solutions"" and showing bulls eye targets on this democratic candidate, and yelling and screaming at rallies, spewing the teapot hate. Posted by: billaldridge | January  9, 2011 12:59 PM 
			| Report abuse Dupnik condemned the ""atmosphere of hatred and bigotry"" that he said has gripped the nation and suggested that the 22-year-old suspect being held in the shooting was mentally ill and therefore more susceptible to overheated messages in the media....... +++++++++++++++++++++++++++++++++++++++++ Of course, we are all responsible for our careless or thoughtless rhetoric, but what the sheriff seems to be saying here is the 22 year old is ""mentally ill"" and therefore not entirely responsible for his own behavior.  I guess this is what separates liberals from conservatives; personal responsibility.  Posted by: sklein19 | January  9, 2011 12:58 PM 
			| Report abuse Republicans have stepped in a pile of their own violent rhetoric, and now they are trying to talk their way out of it. Forget it. The public isn't that stupid. The lesson here is simple -- no more threats of violence, explicit or implied. Don't try it again. We've all had a gut full of it. We're not going to live in that kind of country, and any politician who thinks we are is going to get voted out of office. So you better shape up and watch your mouths. Posted by: dparks2 | January  9, 2011 12:58 PM 
			| Report abuse ""The crossfire is intense, so penetrate through enemy territory by bombing through the press, and use your strong weapons -- your Big Guns -- to drive to the hole. Shoot with accuracy; aim high and remember it takes blood, sweat and tears to win,"" -- Sarah Palin Posted by: insider9909 | January  9, 2011 12:56 PM 
			| Report abuse The sheriff's depiction of AZ as Arizonistan (my metaphor not his) where political opposition is murdered could not be more on the money. Push the button of the person on the edge of sanity they go off. This wacko's self described political terrorism on youtube was actually carried out. Many of the button pushers are Tea Party candidates or electees (Miller, Hayworth, Bachmann, Paul, Palladino) while the Dems play the racist card when Obama is chastised for spending too much. Posted by: jameschirico | January  9, 2011 12:56 PM 
			| Report abuse Last year, two Pittsburgh policemen were killed by a disturbed individual who believed the rightwing fantasy that Obama was going to take away his guns. The far left may be somewhat looney, but you don't hear any of them talking about government overthrow (second amendment solutions) or taking their country back, even at the height of bush-cheney. Leftwingers don't go to marches and rallies packing heat. Lefties do not promote outright lies about the president or the Democrats, let alone the republicans. Ther righties ahve done all that and more. Frankly, I'm just surprised that something like this hasn't happened sooner. Posted by: mikel7 | January  9, 2011 12:55 PM 
			| Report abuse Let's see, who's the real bigot here? Tea partiers, who had nothing at all do with this shooting? Or Sherriff Dupnik, who rushed to condemn politial vitriol (code word: right wing talk radio) before all the facts were in? You're a hack and a tool, Sherriff. And as for Sandhya -- are the Sherriff's comments realling resonating with the ""public,"" are just with left wing partisans and certain Washington Post reporters who sympathize with them? Posted by: guest1 | January  9, 2011 12:55 PM 
			| Report abuse Last year, two Pittsburgh policemen were killed by a disturbed individual who believed the rightwing fantasy that Obama was going to take away his guns. The far left may be somewhat looney, but you don't hear any of them talking about government overthrow (second amendment solutions) or taking their country back, even at the height of bush-cheney. Leftwingers don't go to marches and rallies packing heat. Lefties do ot promote outright lies about the president or the Democrats, let alone the republicans. Ther righties ahve done all that and more. Frankly, I'm just surprised that something like this hasn't happened sooner. Posted by: mikel7 | January  9, 2011 12:54 PM 
			| Report abuse Well, technically, Sheriff, he's innocent until proven guilty; and your instant psychoanalysis of him is not your job.
Also, vitriol comes from both sides of the aisles. There are also many, many people in crisis in the US but nobody's helping them.
There's also no perspective. Alas, shootings of public figures occurs, ""vitriol"" or not. Attempts of actual assassinations just in living memory, JFK, RFK, ML King, Ford, Wallace, Reagan...and all by demented people straight out of the M'naughton rule. Posted by: Beckola | January  9, 2011 12:53 PM 
			| Report abuse Why has Arizona become a Mecca for prejudice and bigotry?  One has to look no further than the Arizona Governor (I wonder if the right will take him to  task for using the word Mecca). Posted by: thomgr | January  9, 2011 12:53 PM 
			| Report abuse Sadly, I've been expecting something like this since the run up to the presidential election.  The vitriol, the provacation and rhetoric coming from the right served as a catalyst to the disrespect, incivility and anger.  Yet, none of the republican legislators (or fox fans, beckheads, limbaugh dittoheads) asked for a calming of the rhetoric - instead, they took their place in the clown parade and defended the right to free speech.  I'm all for free speech, except when it incites violence.  It's been a deliberate campaign to keep the anger frothing - and folks are suprised at the end result?  All to score political points.  It's absolutely pathetic. Bravo Sheriff!! Posted by: notfooledbydistractions1 | January  9, 2011 12:53 PM 
			| Report abuse Most comments do not have the finger on the malady that is affecting our Nation.It is easy for us to say the person responsible is mentaly disturbed-who is not disturbed after the multiple eruptions that have taken place in America. In another country,this would much severe consequences.
 Where is our responsibility?
 There appears to be more chaos in the News than perhaps, at the shooting sight. Comments made here, will not help to bring calm across our country. We all express our aversion to crime,where ever committed, that image is wiped out in our day to day living.Our expressions that come out of dissent are as extreme as our expressions of Happiness. It is not the gun only that is killing, it is our attitudes. In an instant we turn from good to bad, our minds are just balancing on the thin side of the coin or wedge.The same expressions are seen on the TV that we watch every day.Our society is so advanced, we have forgotten the acts of civility, each day is like a Video that is fast-forwarded-this is no way that we should act like this and at the same time preach.God help this countryit, is not war, it is just act of chaos in our mind. Posted by: jayrkay | January  9, 2011 12:53 PM 
			| Report abuse The Washington Post staff is prejudiced, if not bigoted, in how they treat conservatives. Is that part of the problem or is the sheriff just revealing his own prejudices? Posted by: edbyronadams | January  9, 2011 12:52 PM 
			| Report abuse Show me one concrete piece of evidence that:
1. This moron was a 'Follower' of Sarah Palin. 2. That he was a member of the 'Tea Party'. 3. That he ever voted or voted Republican. 4. That he ever contacted Sarah Palin. 5. Proof that he DIDN'T Read and avow Communism. 6. That he wasn't a LIBERAL as described by a close friend to the NYTs. 7. Show me concrete proof ANYONE connected with the Tea party of Republicans or Sarah Palin vandalized her offices!! I'm waiting . . . waiting.  . . . :crickets: Oh, I forgot -- FACTS don't matter to the Despicable LEFT!! Posted by: Armymom10 | January  9, 2011 12:51 PM 
			| Report abuse To sorry Charlie: So if Arizona had used the death penalty more often than 24 times since 1976, then Loughner would have been dissuaded?  I don't think so.  It does seem, however, that Loughner was listening quite closely to Beck and the gun-solutions crowd. Posted by: JPMinNC | January  9, 2011 12:50 PM 
			| Report abuse Maybe this happened because Beck and Limbaugh go around saying they want to kill people; one would have to be mentally unstable to listen to either one of these lying Nazis. It makes me sick to my stomach that it is supposed by some members that this âTea Partyâ selfishness and Republican greed somehow represents anything âChristianâ or even American; these certainly DO NOT and anyone who think these do is self-deceived. Posted by: newsboy3 | January  9, 2011 12:49 PM 
			| Report abuse Sheriff Dupnik said:
