stories_id,publish_date,title,url,language,ap_syndicated,themes,media_id,media_name,media_url,text
29847219,2011-01-13 09:00:00,A Brief History of Presidential Mourning,"http://feedproxy.google.com/~r/time/politics/~3/QDE_RGxPKig/0,8599,2042162,00.html",en,False,,4419,Time,http://time.com,Return to homepage Your browser is out of date. Please update your browser at http://update.microsoft.com
29847772,2011-01-12 22:09:00,Loughner's Smirk Behind Bars,http://www.newsweek.com/2011/01/12/loughner-s-smirk-behind-bars.html,en,False,,2,Washington Post,http://washingtonpost.com,
29847994,2011-01-13 02:38:10,Loughner could have been committed under Arizona law,http://rssfeeds.usatoday.com/~r/usatoday-NewsTopStories/~3/r6JW5-TRBBo/2011-01-13-arizonalaws13_st_N.htm,en,False,,4,USA Today,http://www.usatoday.com,"Arizona makes it easier than most states to commit mentally ill people to psychiatric care, even against their will. But that doesn't mean that everyone gets the help they need. ""The state laws are some of the best in the country,"" said Jack Potts, a forensic psychiatrist in Phoenix. ""The follow-up is not."" Under Arizona law, anyone can call the county or regional health authorities with concerns about a person's mental health, and authorities are required to send out mobile units to assess the person's condition, said Brian Stettin, policy director at the Treatment Advocacy Center in Arlington, Va., which advocates for involuntary commitment for mental illness. The person who files a request for commitment must list the names of two witnesses who can attest to the subject's behavior, although they don't have to sign the document themselves, Potts said. REPORTS: Loughner had 'dark personality' POLL: Conservatives not to blame for Ariz. shooting Typically, states allow involuntary commitment only if people pose a danger to themselves or others, or if they are profoundly disabled by their mental illness, to the point of being unable to take care of themselves, said Paul Ragan, associate professor of psychiatry at the Vanderbilt University School of Medicine in Nashville. But Arizona allows for involuntary commitment if someone is deteriorating from a mental illness and could benefit from treatment, Potts said. The law is intended to catch people before they do something dangerous. He said he knows of a high school principal, for example, who requested a mental health evaluation for an unstable student. The law also provides up to 90 days of inpatient hospital treatment, Potts said. A judge can order a patient to take his medication; patients who refuse can be sent back to the hospital. Yet Arizona often lacks the resources to treat people, he said. The state has one of the lowest ratios in the country for inpatient psychiatric beds for its population size. Across the USA, budget cuts have forced hospitals to close 4,000 inpatient psychiatric beds since 2009 — leaving them less able to take in the mentally ill, said Michael Fitzpatrick, executive director of the National Alliance on Mental Illness (NAMI). Arizona has eliminated hundreds of positions for mental health case workers, who help coordinate patients' care, Fitzpatrick said. In a national score card rating the accessibility of mental health services, the alliance in 2009 gave Arizona a C, ""which is pretty close to a failing grade,"" said psychiatrist Anand Pandya of Cedars-Sinai Medical Center in Los Angeles; 21 states scored a D, and none earned an A. To create the score card, the alliance had volunteers in each state try to schedule an appointment with a mental health professional. ""It's very hard to get an appointment with a psychiatrist in Arizona,"" Pandya said. ""Pretty much across the board, it takes a lot of time. There's no one clear number to call, and it's hard to figure out where to go from their website, even if you are completely mentally competent. The services in Arizona just aren't designed to be readily accessible."" PARENTS: Mental health lessons from the Tucson tragedy Arizona state officials, for example, were unable to tell NAMI how many patients they actually serve, according to the report. Arizona residents who spoke to NAMI for the report said they had many problems getting care, facing six- to eight-week waits to see a psychiatrist. Others complained of overworked case workers with nearly 100 clients. One unnamed patient quoted in the report told NAMI, ""When I first tried to get help after attempting suicide, I was told that I wasn't sick enough to qualify."""
29848801,2011-01-12 23:26:10,"Due To Arizona Conflicts, California Judge Takes Over Loughner Case",http://feedproxy.google.com/~r/TPMmuckraker/~3/nbPgejH2xt0/due_to_arizona_conflicts_california_judge_takes_ov.php,en,False,,113,Talking Points Memo,http://www.talkingpointsmemo.com,
29850127,2011-01-13 10:13:05,Memorial to honor youngest victim of Arizona mass shootings,http://rss.cnn.com/~r/rss/cnn_latest/~3/u2coAeFYnV4/index.html,en,False,,1095,CNN,http://www.cnn.com/,
29851613,2011-01-12 23:36:00,Ariz. hospital workers fired for accessing records,http://www.miamiherald.com/2011/01/12/2013302/ariz-hospital-workers-fired-for.html,en,True,,28,Miami Herald,http://www.miamiherald.com/
29853811,2011-01-13 06:28:11,"Obama: In wake of tragic shooting, let's shelve blame and embrace civility",http://www.twincities.com/news/ci_17081347?source=rss,en,False,,52,St.Paul Pioneer-Press ,http://www.twincities.com/,"GET BREAKING NEWS IN YOUR BROWSER. CLICK HERE TO TURN ON NOTIFICATIONS. X OUR PICKS: TUCSON, Ariz. — President Barack Obama comforted a community suffused with grief and summoned the nation to recommit to a more civil public discourse as he delivered a eulogy Wednesday evening urging Americans to talk with each other “in a way that heals, not in a way that wounds.” Evoking memories of the six killed Saturday in Tucson, Obama seized upon the mass shooting at a congresswoman’s supermarket meet-and-greet to tackle the subject of the nation’s harsh political dialogue. He decried the “politics and point-scoring and pettiness that drifts away with the next news cycle.” “Rather than pointing fingers or assigning blame, let us use this occasion to expand our moral imaginations, to listen to each other more carefully, to sharpen our instincts for empathy, and remind ourselves of all the ways our hopes and dreams are bound together,” Obama told 14,000 people at the University of Arizona’s McKale Memorial Center. Obama did not ascribe a political motive to the alleged shooter or suggest that either party was to blame. Rather, in a 33-minute speech, he sought to move the nation past the tragedy. Accompanied at the arena by first lady Michelle Obama, the president said he joins Tucson in its grief and that he came “as an American who, like all Americans, kneels to pray with you today and will stand by you tomorrow.” After touching down under blue skies and a bright desert sun, Obama paid a surprise visit to victims recovering at University Medical Center, including Rep. Gabrielle Giffords, D-Ariz., whom he joined for nine minutes in the intensive care unit. “Gabby opened her eyes, and I can tell you she knows we are here, she knows we love her and she knows we are rooting for her,” Obama said. Wednesday evening’s hourlong “Together We Thrive: Tucson and America” service was full of spiritual overtones. Homeland Security Secretary Janet Napolitano read from the Bible’s book of Isaiah, and Attorney General Eric Holder read from Corinthians. Audience members cheered and hollered throughout the service, at times making it appear more like a rally than a somber memorial. Organizers distributed navy T-shirts to attendees, many of whom snapped pictures of Obama and a litany of dignitaries, including Republican Arizona Gov. Jan Brewer. But the crowd did not lose sight of the purpose. As Giffords’ family entered with three hospital surgeons wearing white lab coats over their scrubs, the crowd stood in applause. Other heroes of the shooting, including Daniel Hernandez, the intern who tended to Giffords at the crime scene, were engulfed in cheers as they were shown on the arena’s video screen. Obama looked gravely serious throughout, pursing his lips even when the crowd screamed in delight. The rampage called for Obama to console weary citizens just as President George W. Bush did after the Sept. 11, 2001, terrorist attacks and President Bill Clinton after the 1995 Oklahoma City bombing. For Obama, it was not the first time he had addressed tragedy and divisiveness. A hallmark of his tenure has been his eagerness to cast himself as a healer. Obama shared personal details he had learned about the six dead: “Our hearts are broken by their sudden passing,” Obama said. “Our hearts are broken — and yet, our hearts also have reason for fullness.” The president said he was grateful for Hernandez, Patricia Maisch and others who ran through chaos at the scene of the massacre to save others. “These men and women remind us that heroism is found not only on the fields of battle,” Obama said. “They remind us that heroism does not require special training or physical strength. Heroism is here, all around us, in the hearts of so many of our fellow citizens, just waiting to be summoned — as it was on Saturday morning.” Obama’s advisers said his remarks were designed to help tamp down the current political conversation. He ruminated about young Christina’s growing interest in her government. As he focused on the child, his wife’s eyes brimmed with tears, and his remarks drew a sustained standing ovation as many in the crowd wept. “She saw all this through the eyes of a child, undimmed by the cynicism or vitriol that we adults all too often just take for granted,” Obama said. “I want us to live up to her expectations. I want our democracy to be as good as (Christina) imagined it. … All of us — we should do everything we can to make sure this country lives up to our children’s expectations. “If there are rain puddles in heaven, Christina is jumping in them today,” he said. “And here on Earth, we place our hands over our hearts, and we commit ourselves as Americans to forging a country that is forever worthy of her gentle, happy spirit.” With the State of the Union address less than two weeks away, Obama’s advisers said it is likely the president will raise the subject again in some manner in the days after the funerals have finished — perhaps in his speech to Congress. Sign up for Newsletters and Alerts As you comment, please be respectful of other commenters and other viewpoints. Our goal with article comments is to provide a space for civil, informative and constructive conversations. We reserve the right to remove any comment we deem to be defamatory, rude, insulting to others, hateful, off-topic or reckless to the community. See our full terms of use 
			here."
29855347,2011-01-13 03:13:00,Obama Calls On Nation To Live Up To A Child's Ideals,http://www.npr.org/blogs/itsallpolitics/2011/01/13/132877316/obama-calls-nation-to-live-up-to-childrens-ideals?ft=1&f=1003,en,False,,1096,NPR,http://www.npr.org/,"NPR’s sites use cookies, similar tracking and storage technologies, and information about the device you use to access our sites (together, “cookies”) to enhance your viewing, listening and user experience, personalize content, personalize messages from NPR’s sponsors, provide social media features, and analyze NPR’s traffic. This information is shared with social media, sponsorship, analytics, and other vendors or service providers. 
            See details. You may click on “Your Choices” below to learn about and use cookie management tools to limit use of cookies when you visit NPR’s sites. You can adjust your cookie choices in those tools at any time. If you click “Agree and Continue” below, you acknowledge that your cookie choices in those tools will be respected and that you otherwise agree to the use of cookies on NPR’s sites.  NPR’s Terms of Use and Privacy Policy."
29855745,2011-01-13 08:00:41,Papers show series of run-ins for Loughner,http://rss.usatoday.mlogic3g.com/detail.jsp?key=2335903&amp;rc=main,en,False,,4,USA Today,http://www.usatoday.com
29858676,2011-01-13 04:03:00,"At Arizona memorial, Obama urges a discussion that heals",http://www.miamiherald.com/2011/01/12/2013712/at-arizona-memorial-obama-urges.html,en,False,,28,Miami Herald,http://www.miamiherald.com/
29861789,2011-01-13 13:03:00,Ex-girlfriend says Tucson shooting suspect changed,http://feeds.sfgate.com/click.phdo?i=0637b45b58a758fed41040b2d5c0b116,en,True,,14,SF Chronicle,http://www.sfgate.com/,451 Unavailable For Legal Reasons
29861797,2011-01-13 12:00:00,Obama offers comfort after Tucson shootings,http://feeds.sfgate.com/click.phdo?i=f5c1c34c51f8d690925c5ad32dc5cc1f,en,False,,14,SF Chronicle,http://www.sfgate.com/,451 Unavailable For Legal Reasons
29866907,2011-01-13 17:32:28,"Gabrielle Giffords office is open, helping constituents and providing solace",http://rss.csmonitor.com/~r/feeds/usa/~3/_B7-Tm2XXNc/Gabrielle-Giffords-office-is-open-helping-constituents-and-providing-solace,en,False,,3,Christian Science Monitor,http://csmonitor.com,The requested URL was not found on this server.
29868309,2011-01-13 19:19:20,"9/11 flag unfurled, raised for Arizona girl's funeral",http://www.mercurynews.com/news/ci_17087036?source=rss,en,True,,35,San Jose Mercury News,http://www.mercurynews.com/,"Trending:  In this photo provided by the family, Christina Green is shown. Green, 9, was killed at a political event with Rep. Gabrielle Giffords in Tucson, Ariz. on Saturday, Jan. 8, 2011. (AP Photo/Green Family) NO SALES  Firefighters raise the large American flag recovered from Ground Zero after the 9/11 attacks outside the entrance at the St. Elizabeth Ann Seton Church for the funeral of 9-year-old Christina Taylor Green Thursday, Jan. 13, 2011, in Tucson, Ariz. Green, the youngest victim of Saturday's shooting in Tucson, was born on the day of the Sept. 11 attacks in 2001.  (AP Photo/Mamta Popat, Pool)  TUCSON, AZ - JANUARY 13:  The funeral hearse leads a procession to St. Elizabeth Ann Seton church for the funeral services of nine-year-old Christina Taylor Green on January 13, 2011 in Tucson, Arizona. Green was shot and killed during the January 8, shooting rampage of Jared Lee Loughner during a political event in Tucson. (Photo by David Becker/Getty Images)  Rozanna and John Green, the mother and father of Christina Green, stand with their son Dallas as they arrive for Christina's funeral at the St. Elizabeth Ann Seton Church on Thursday, Jan. 13, 2011, in Tucson, Ariz. Green was the youngest victim of Saturday's shooting in Tucson. (AP Photo/Mamta Popat, Pool)  TUCSON, AZ - JANUARY 13: Pallbearers escort the casket of nine-year-old Christina Taylor Green into St. Elizabeth Ann Seton church on January 13, 2011 in Tucson, Arizona. Green was shot and killed during the January 8, shooting rampage of Jared Lee Loughner during a political event in Tucson. (Photo by Mamta Popat-Pool/Getty Images)  John Green and son Dallas, the respective father and brother of 9-year-old Christina Green, arrive at the St. Elizabeth Ann Seton Church for Christina's funeral on Thursday, Jan. 13, 2011, in Tucson, Ariz. Green was the youngest victim of Saturday's shooting in Tucson. (AP Photo/Mamta Popat, Pool)  A hearse arrives at the St. Elizabeth Ann Seton Church for the funeral of 9-year-old Christina Green Thursday, Jan. 13, 2011, in Tucson, Ariz. Green was the youngest victim of Saturday's shooting in Tucson. (AP Photo/Chris Carlson)  TUCSON, Ariz. — The family of the youngest victim of the mass shooting in Arizona held hands and paused in a moment of silence Thursday under the large American flag recovered from Ground Zero after the 9/11 attacks, and later escorted the 9-year-old’s small brown casket into the church as little girls about her age cried. Several hundred other mourners, many in white T-shirts, lined a road near the church to show support. Christina Taylor Green was born on Sept. 11, 2001, and featured in a book called “Faces of Hope” that chronicled one baby from each state born on the day terrorists killed nearly 3,000 people. Christina’s funeral is the first for the six victims killed when police said a gunman opened fired on a crowd at an event for Rep. Gabrielle Giffords, critically injuring the congresswoman and wounding 13 others. The third-grader had an interest in politics and had recently been elected to her student council. She was the only girl on her Canyon del Oro Little League baseball team and played second base, and had told her father she wanted to become the first woman to play in the major leagues. The game was in her blood. Her dad is a scout for the Los Angeles Dodgers and her grandfather, former big league pitcher Dallas Green, managed the 1980 world champion Philadelphia Phillies. During President Barack Obama’s speech at a memorial Wednesday night, he spoke at length about Christina and reminded the audience that the third-grader’s neighbor had brought her to meet Giffords because of her budding interest in democracy. “She saw all this through the eyes of a child, undimmed by the cynicism or vitriol that we adults all too often just take for granted,” he said. “I want to live up to her expectations. I want our democracy to be as good as Christina imagined it. I want America to be as good as she imagined it.” The girl had told her parents she wanted to attend Penn State and have a career that involved helping those less fortunate. Before her funeral, cars were parked on both sides of the road, and traffic was backed up. Members of motorcycle groups from Arizona and California parked their bikes in a group. Several hundred people, many dressed in white T-shirts, stood silently along a road near the church. About 20 people were dressed as angels. They organized over the Internet and by word of mouth, saying they wanted to be there in case members of a Kansas church showed up to protest. The Westboro Baptist Church threatened to picket the funerals for Christina and other victims, but they backed off, in part because a nationally syndicated radio show agreed to host some of their members. The church is known for protesting at the funerals of slain servicemen and blaming their deaths on the country’s tolerance of homosexuality. As the city mourned the little girl, more details and documents surfaced about the suspect, Jared Loughner. For four years, he was an unremarkable college student, commuting to classes near his home where he studied yoga and algebra, business management and poetry. But last year, his classroom conduct began to change. In February, Loughner stunned a teacher by talking about blowing up babies, a bizarre outburst that marked the start of a rapid unraveling for the 22-year-old. After his first flare-up, campus police decided not to intervene. “I suggested they keep an eye on him,” an officer wrote. Loughner’s on-campus behavior grew increasingly erratic, menacing, even delusional. Fifty-one pages of police reports released Wednesday provided a chilling portrait of Loughner’s last school year, which ended in September when he was judged mentally unhinged and suspended by Pima Community College. New details were also still emerging about the busy morning Loughner had in the hours before the shooting. According to authorities, Loughner hustled to Walmart twice, was caught by police running a red light but was let go with a warning, and later grabbed a black bag from the trunk of a family car before fleeing into the desert on foot with his suspicious father giving chase. Eventually, he took a cab to the grocery store where he opened fire on Giffords and a line of people waiting to speak to her. Loughner was also carrying a knife but didn’t use it. Also Thursday, a man walking his dog found a black bag holding ammunition and authorities believed it was discarded by Loughner. Chief Rick Kastigar with the Pima County Sheriff’s Office told The Associated Press that an 18-year-old found the bag in a neighborhood near where Loughner lives. He went to get another man, who looked inside and saw ammunition. Just three months before the shooting, Loughner had been kicked out of school. In a Sept. 23 campus police report, days before his suspension, an officer called to quiet another one of Loughner’s outbursts described him as incomprehensible, his eyes jittery, his head awkwardly tilted. “He very slowly began telling me in a low and mumbled voice that under the Constitution, which had been written on the wall for all to see, he had the right to his ‘freedom of thought’ and whatever he thought in his head he could also put on paper. … His teacher ‘must be required to accept it’ as a passing grade,” the officer wrote. “It was clear he was unable to fully understand his actions.” During his first outburst, in a poetry class, he made comments about abortion, wars and killing people, then asked: “Why don’t we just strap bombs to babies?” Later, he became hostile with a Pilates instructor when he learned he was going to receive a B in the class. According to school officials, Loughner studied at the college from the summer of 2005 to September, when he was suspended after campus police discovered a YouTube video in which Loughner claimed the college was illegal under to the U.S. Constitution. In all, he had five run-ins with police on two campuses. Loughner was warned that the behavior had to stop. On Nov. 30, the same day he bought the Glock, Loughner posted a YouTube video, seething about campus police and the college. “If the police remove you from the educational facility for talking then removing you from the educational facility for talking is unconstitutional,” he said on the video. “The situation is fraud because the police are unconstitutional. … Every Pima Community College class is always a scam!” School officials told Loughner and his parents that to return to classes he would need to undergo a mental health exam to show he was not a danger. He never returned. Kelsey Hawkes said Thursday on CBS’ “The Early Show” that when she dated Loughner six years ago when they were both in high school, he showed no violent tendencies and he was a completely different person. “Very caring, very sweet, a gentle, kind, you know, a little bit quiet. But altogether a pretty great guy,” she said. Associated Press writers Amanda Lee Myers, Alicia Chang and Gillian Flaccus in Tucson, and Jacques Billeaud and Bob Christie in Phoenix contributed to this report. Get Morning Report and other email newsletters"
29871267,2011-01-13 19:14:04,"Commentary: Rhetoric didn't incite shooting, but it's unhealthy for the nation",http://www.sacbee.com/2011/01/13/3322138/commentary-rhetoric-didnt-incite.html#mi_rss=Wire%20Lifestyle,en,False,,26,Sac Bee,http://www.sacbee.com/
29871946,2011-01-13 13:59:18,Parents of suspect..,http://feeds.foxnews.com/~r/blogs/Gretawire/~3/8RqTOhKX0Vc/,en,True,,1092,Fox News,http://www.foxnews.com/
